uid,title,abstract,year,venue,authors,doi,arxiv_id,url,source,query,query_role,family,advisor_seed,citation_count,matched_terms,retrieved_at,relevance_score,hostile_score
doi:10.1609/aaai.v40i22.38902,DiTEA: Mixture-of-Experts for Vision-Language-Action Model in Robotic Manipulation,"The current diffusion-based Vision-Language-Action (VLA) models have faster inference speed and the ability to solve the action muti-modality problem in robot manipulation tasks compared to traditional autoregressive models after large-scale pre-training and post-training. However, the diffusion-based VLA models were found to have poor instruction-following ability, and after fine-tuning training on multiple tasks, them often suffer from ""skill forgetting"" due to conflicting model weights on each task. To address this problem, we propose DiTEA, a Diffusion Transformer-based Mixture-of-Experts (MoE) VLA model. Specifically, it fuses the MoE module into the action head of VLA to form Action MoE, and in addition, we design the Task-Instruction Gate, which uses language instructions to select specific experts for tasks they specialize in, in order to improve the VLA's instruction-following a",2026,Proceedings of the AAAI Conference on Artificial Intelligence,Chengxuan Li; Xingwan Wang,10.1609/aaai.v40i22.38902,,https://doi.org/10.1609/aaai.v40i22.38902,crossref,vision language action model limitation robotics,hostile,failure,,,vision language action model; robot manipulation; limitation; ablation,2026-06-12T14:45:03Z,12.300,18.300
arxiv:2606.12956v1,SERF: Spatiotemporal Environment and Robot Feature Map for Long-Horizon Mobile Manipulation,"Long-horizon robot mobile manipulation requires continual reasoning about localization, environment changes, and task progress, all of which are challenging to infer from image observations alone. In this paper, we show that conditioning a mobile manipulation policy on a spatiotemporal feature map improves reasoning over long horizons. The map represents the environment and the articulated robot body as neural points in a shared latent space and is updated online from egocentric observations and proprioceptive state. We update the environment neural points using object-level rigid tracking and the robot neural points using forward kinematics. We use our spatiotemporal environment and robot feature (SERF) map as a state input to a vision-language-action (VLA) model by extracting map tokens from multiple reference frames and spatial scales, providing the policy with both local and global c",2026,arXiv,Sunghwan Kim; Byeonghyun Pak; Kehan Long; Yulun Tian; Nikolay Atanasov,,2606.12956v1,http://arxiv.org/abs/2606.12956v1,arxiv,Gaussian splatting robot perception mobile manipulation,concept,architecture_x_embodiment,,,Gaussian splatting robot perception; mobile manipulation; benchmark; robustness; long horizon,2026-06-12T15:07:36Z,16.200,18.200
doi:10.1080/10407413.2014.874908,Building Tool Use From Object Manipulation: A Perception–Action Perspective,,2014,Ecological Psychology,Björn A. Kahrs; Jeffrey J. Lockman,10.1080/10407413.2014.874908,,https://doi.org/10.1080/10407413.2014.874908,crossref,deformable object manipulation robot learning,concept,deformable,,22,deformable object manipulation,2026-06-12T15:07:36Z,18.168,18.168
doi:10.1002/asjc.1092,TP Model Transformation as a Manipulation Tool for QLPV Analysis and Design,"Abstract The main motivation of the TP model transformation is that modern identification and control analysis, along with design methodologies, are based on various kinds of different representations that have different benefits and drawbacks in terms of identification and modeling effort and structure, however, the link between these representations is in many cases difficult to establish, especially if the model components are not given by closed formulae but rather by various soft‐computing‐based or black box models. This paper shows that the TP model transformation can serve as a gateway between different representations by bridging to a widely adopted polytopic representation. Further, it is capable of readily manipulating the resulting polytopic representation for further design requirements, which in many cases has a strong effect on the resulting control performance and the cons",2015,Asian Journal of Control,Péter Baranyi,10.1002/asjc.1092,,https://doi.org/10.1002/asjc.1092,crossref,model predictive control manipulation,anti_myopia,anti_thesis,,50,model predictive control; model predictive control manipulation,2026-06-12T15:07:36Z,14.166,18.166
arxiv:2511.09516v1,MAP-VLA: Memory-Augmented Prompting for Vision-Language-Action Model in Robotic Manipulation,"Pre-trained Vision-Language-Action (VLA) models have achieved remarkable success in improving robustness and generalization for end-to-end robotic manipulation. However, these models struggle with long-horizon tasks due to their lack of memory and reliance solely on immediate sensory inputs. To address this limitation, we propose Memory-Augmented Prompting for Vision-Language-Action model (MAP-VLA), a novel framework that empowers pre-trained VLA models with demonstration-derived memory prompts to augment action generation for long-horizon robotic manipulation tasks. To achieve this, MAP-VLA first constructs a memory library from historical demonstrations, where each memory unit captures information about a specific stage of a task. These memory units are implemented as learnable soft prompts optimized through prompt tuning. Then, during real-time task execution, MAP-VLA retrieves releva",2025,arXiv,Runhao Li; Wenkai Guo; Zhenyu Wu; Changyuan Wang; Haoyuan Deng; Zhenyu Weng; Yap-Peng Tan; Ziwei Wang,,2511.09516v1,http://arxiv.org/abs/2511.09516v1,arxiv,vision language action model limitation robotics,hostile,failure,,,vision language action model; limitation; benchmark; generalization; robustness; long horizon,2026-06-12T14:45:03Z,10.150,18.150
doi:10.1002/ece3.11400,Temperature and soil moisture manipulation yields evidence of drought‐induced pollen limitation in bee‐pollinated squash,"Abstract Climate change alters environmental conditions in ways that directly and indirectly affect plants. Flowering plants, for example, modify reproductive allocation in response to heat and drought stress, and such changes can in turn affect pollinator visitation and, ultimately, plant reproduction. Although the individual effects of warming and drought on plant reproductive allocation are well known, these factors may interact to influence reproduction. Here, we conducted a fully crossed temperature by irrigation manipulation in squash ( Cucurbita pepo ) to test how temperature and soil moisture variation affect pollinator‐mediated reproduction. To tease apart the direct and indirect effects of temperature and soil moisture, we compared hand‐pollinated plants to bee‐pollinated plants and restricted bee foraging (i.e., pollen transfer) to one experimental group per day. Temperature a",2024,Ecology and Evolution,Jess Gambel; David A. Holway,10.1002/ece3.11400,,https://doi.org/10.1002/ece3.11400,crossref,diffusion policy limitation robot manipulation,hostile,failure,,7,diffusion policy; robot manipulation; limitation; diffusion policy limitation,2026-06-12T15:07:36Z,13.140,18.140
doi:10.1152/jn.00384.2019,Toward natural grasping with a tool: effects of practice and required accuracy on the kinematics of tool-use grasping,"This study is the first reporting the relation between characteristic aperture time profile, called plateau duration, and movement time of tool-use grasping. The results suggest that improved coordination between reaching and grasping components was induced by improvement in the proficiency of tool use but not by just shortened movement time. The results also indicate the possibility that the constraints for calculations in motor planning are essentially the same between hand-use grasping and tool-use grasping.",2020,Journal of Neurophysiology,Yoshihiro Itaguchi,10.1152/jn.00384.2019,,https://doi.org/10.1152/jn.00384.2019,crossref,analytical grasping,anti_myopia,anti_thesis,,9,analytical grasping,2026-06-12T15:07:36Z,15.051,18.051
doi:10.1109/iros51168.2021.9636297,Behavior Self-Organization Supports Task Inference for Continual Robot Learning,"Recent advances in robot learning have enabled robots to become increasingly better at mastering a predefined set of tasks. On the other hand, as humans, we have the ability to learn a growing set of tasks over our lifetime. Continual robot learning is an emerging research direction with the goal of endowing robots with this ability. In order to learn new tasks over time, the robot first needs to infer the task at hand. Task inference, however, has received little attention in the multi-task learning literature. In this paper, we propose a novel approach to continual learning of robotic control tasks. Our approach performs unsupervised learning of behavior embeddings by incrementally self-organizing demonstrated behaviors. Task inference is made by finding the nearest behavior embedding to a demonstrated behavior, which is used together with the environment state as input to a multi-task",2021,2021 IEEE/RSJ International Conference on Intelligent Robots and Systems (IROS),Muhammad Burhan Hafez; Stefan Wermter,10.1109/iros51168.2021.9636297,,https://doi.org/10.1109/iros51168.2021.9636297,openalex,robotics,concept,openalex_bulk_robotics,,17,continual learning; generalization,2026-06-12T18:57:17Z,16.995,17.995
doi:10.1145/3729343,VLATest: Testing and Evaluating Vision-Language-Action Models for Robotic Manipulation,"The rapid advancement of generative AI and multi-modal foundation models has shown significant potential in advancing robotic manipulation. Vision-language-action (VLA) models, in particular, have emerged as a promising approach for visuomotor control by leveraging large-scale vision-language data and robot demonstrations. However, current VLA models are typically evaluated using a limited set of hand-crafted scenes, leaving their general performance and robustness in diverse scenarios largely unexplored. To address this gap, we present VLATest, a fuzzing framework designed to generate robotic manipulation scenes for testing VLA models. Based on VLATest, we conducted an empirical study to assess the performance of seven representative VLA models. Our study results revealed that current VLA models lack the robustness necessary for practical deployment. Additionally, we investigated the im",2025,Proceedings of the ACM on Software Engineering,Zhijie Wang; Zhehua Zhou; Jiayang Song; Yuheng Huang; Zhan Shu; Lei Ma,10.1145/3729343,,https://doi.org/10.1145/3729343,crossref,vision language action model limitation robotics,hostile,failure,,7,vision language action model; limitation; robustness; deployment,2026-06-12T15:07:36Z,10.990,17.990
doi:10.1016/j.compag.2025.110365,Precision robotic spot-spraying: Reducing herbicide use and enhancing environmental outcomes in sugarcane,"Precise robotic weed control plays an essential role in precision agriculture. It can help significantly reduce the environmental impact of herbicides while reducing weed management costs for farmers. In this paper, we demonstrate that a custom-designed robotic spot spraying tool based on computer vision and deep learning can significantly reduce herbicide usage on sugarcane farms. We present results from field trials that compare robotic spot spraying against industry-standard broadcast spraying, by measuring the weed control efficacy, the reduction in herbicide usage, and the water quality improvements in irrigation runoff. The average results across 25 hectares of field trials show that spot spraying on sugarcane farms is 97% as effective as broadcast spraying and reduces herbicide usage by 35%, proportionally to the weed density. For specific trial strips with lower weed pressure, sp",2025,Computers and Electronics in Agriculture,Mostafa Rahimi Azghadi; Alex Olsen; Jake Wood; Alzayat Saleh; Brendan Calvert; Terry Granshaw; Emilie Fillols; Bronson Philippa,10.1016/j.compag.2025.110365,,https://doi.org/10.1016/j.compag.2025.110365,openalex,robotics,concept,openalex_bulk_robotics,,24,,2026-06-12T18:57:17Z,17.959,17.959
doi:10.1108/ir-03-2025-0080,Human-assisted reinforcement learning and dynamic force patterns in contact-rich manipulation for robotic disassembly,"Purpose The escalating rates of material consumption and energy usage, along with resulting waste, pose significant environmental challenges. Circular economy principles, remanufacturing and disassembly strategies emerge as potential solutions to mitigate these impacts. However, disassembly processes face a critical hurdle due to the inherent variability of products. The purpose of this study is to explore the potential of human-assisted reinforcement learning approaches to effectively manage this variability and improve the adaptability and performance of disassembly operations. Design/methodology/approach This paper investigates the application of reinforcement learning employed with robot–human interactions to address this variability in disassembly, particularly in contact-rich tasks. In addition, this paper proposes using an impedance controller augmented with overlaid force oscilla",2026,Industrial Robot: the international journal of robotics research and application,Nestor Arana-Arexolaleiba; Antonio Serrano; Dimitrios Chrysostomou,10.1108/ir-03-2025-0080,,https://doi.org/10.1108/ir-03-2025-0080,crossref,contact dynamics robot learning,concept,contact,,,contact rich manipulation; contact dynamics; impedance control; limitation; generalization,2026-06-12T14:45:03Z,15.950,17.950
doi:10.1177/21695172261439479,HyReach: Vision-Guided Hybrid Manipulator Reaching in Cluttered Unseen Environments,"As robotic systems increasingly operate in unstructured, cluttered, and previously unseen environments, there is a growing need for manipulators that combine compliance, adaptability, and precise control. This work presents a real-time hybrid rigid–soft continuum manipulator system designed for robust open-world object reaching in such challenging environments. The system integrates vision-based perception and 3D scene reconstruction with shape-aware motion planning to generate safe trajectories. A learning-based controller drives the hybrid arm to arbitrary target poses, leveraging the flexibility of the soft segment while maintaining the precision of the rigid segment. The system operates without environment-specific retraining, enabling direct generalization to new scenes. Extensive real-world experiments demonstrate consistent reaching performance with errors below 2 cm across divers",2026,Soft Robotics,Shivani Kamtikar; Kendall Koe; Justin Wasserman; Samhita Marri; Benjamin Walt; Naveen Kumar Uppalapati; Girish Krishnan; Girish Chowdhary,10.1177/21695172261439479,,https://doi.org/10.1177/21695172261439479,crossref,vision language action model limitation robotics,hostile,failure,,,vision language action model; motion planning; limitation; generalization,2026-06-12T15:07:36Z,9.950,17.950
doi:10.1101/2024.02.21.581369,SpaCCC: Large language model-based cell-cell communication inference for spatially resolved transcriptomic data,"Drawing parallels between linguistic constructs and cellular biology, large language models (LLMs) have achieved remarkable success in diverse downstream applications for single-cell data analysis. However, to date, it still lacks methods to take advantage of LLMs to infer ligand-receptor (LR)-mediated cell-cell communications for spatially resolved transcriptomic data. Here, we propose SpaCCC to facilitate the inference of spatially resolved cell-cell communications, which relies on our fine-tuned single-cell LLM and functional gene interaction network to embed ligand and receptor genes expressed in interacting individual cells into a unified latent space. The LR pairs with a significant closer distance in latent space are taken to be more likely to interact with each other. After that, the molecular diffusion and permutation test strategies are respectively employed to calculate the co",,,Boya Ji; Liwen Xu; Shaoliang Peng,10.1101/2024.02.21.581369,,https://doi.org/10.1101/2024.02.21.581369,crossref,large language model limitation robot planning,anti_myopia,anti_thesis,,3,limitation; benchmark; large language model limitation robot planning,2026-06-12T15:07:36Z,12.943,17.943
doi:10.47611/jsrhs.v12i1.4076,Disentanglement of Latent Factors of Real and Fake Appearance for Deepfake Face Manipulation Detection,"A deepfake video is a video in which generative models are used to alter the facial features to make the subject appear to be a different person. There are various ways to utilize such content, including those that are positive such as entertainment. However, it is also very easy to exploit deepfake videos for harmful use, including for spreading fake news or creating unwanted content. Thus there have been numerous attempts to detect whether a video has been manipulated using deepfake technology so as to prevent further harm. Previous approaches for achieving this purpose have attempted to detect discrepancies in the video frames through the use of techniques such as exploiting the temporal consistency between each frame with convolutional neural networks. Though this has produced adequate results, its accuracy is insufficient for real-world use. In this paper, we propose a novel method ",2023,Journal of Student Research,Suh-Yoon Hong; Dayul Park; GeunJung Yi,10.47611/jsrhs.v12i1.4076,,https://doi.org/10.47611/jsrhs.v12i1.4076,crossref,sim to real robot manipulation,concept,sim2real,,1,robot manipulation,2026-06-12T15:07:36Z,15.897,17.897
arxiv:2601.23087v4,CoLA-Flow Policy: Temporally Coherent Imitation Learning via Continuous Latent Action Flow Matching for Robotic Manipulation,"Learning long-horizon robotic manipulation requires jointly achieving expressive behavior modeling, real-time inference, and stable execution, which remains challenging for existing generative policies. Diffusion-based approaches offer strong modeling capacity but incur high inference latency, while flow matching enables fast, near-single-step generation yet often suffers from unstable execution when operating directly in the raw action space. We propose Continuous Latent Action Flow Policy (CoLA-Flow Policy), a trajectory-level imitation learning framework that performs flow matching in a continuous latent action space. By encoding action sequences into temporally coherent latent trajectories and learning an explicit latent-space flow, CoLA-Flow Policy decouples global motion structure from low-level control noise, enabling smooth and reliable long-horizon execution. The framework furth",2026,arXiv,Wu Songwei; Jiang Zhiduo; Sun Wandong; Xie Guanghu; Zhao Rui; Liu Hong; Liu Yang,,2601.23087v4,http://arxiv.org/abs/2601.23087v4,arxiv,flow matching policy,concept,architecture,,,flow matching policy; imitation learning; robustness; long horizon; latency,2026-06-12T14:45:03Z,16.850,17.850
arxiv:2605.16257v1,DexJoCo: A Benchmark and Toolkit for Task-Oriented Dexterous Manipulation on MuJoCo,"Achieving human-level manipulation requires dexterous robotic hands capable of complex object interactions. Advancing such capabilities further demands standardized benchmarks for systematic evaluation. However, existing dexterous benchmarks lack tasks that reflect the unique manipulation capabilities of dexterous hands over parallel grippers, as well as comprehensive evaluation pipelines. In this paper, we present DexJoCo, a benchmark and toolkit for task-oriented dexterous manipulation, comprising 11 functionally grounded tasks that evaluate tool-use, bimanual coordination, long-horizon execution, and reasoning. We develop a low-cost data collection system and collect 1.1K trajectories across these tasks, with support for domain randomization to assess robustness. We benchmark modern models under diverse settings, including visual and dynamics randomization, multi-task training, and ac",2026,arXiv,Hanwen Wang; Weizhi Zhao; Xiangyu Wang; Siyuan Huang; He Lin; Boyuan Zheng; Rongtao Xu; Gang Wang; Yao Mu; He Wang; Lue Fan; Hongsheng Li; Zhaoxiang Zhang; Tieniu Tan,,2605.16257v1,http://arxiv.org/abs/2605.16257v1,arxiv,EBM transformer robotics dexterous manipulation,concept,architecture_x_embodiment,,,EBM transformer robotics; dexterous manipulation; domain randomization; limitation; benchmark; robustness; long horizon,2026-06-12T15:07:36Z,13.850,17.850
doi:10.1109/lcsys.2022.3181800,NOSNOC: A Software Package for Numerical Optimal Control of Nonsmooth Systems,"This letter introduces the NOnSmooth Numerical Optimal Control (NOSNOC) open-source software package. It is a modular MATLAB tool based on CasADi and IPOPT for numerically solving Optimal Control Problems (OCP) with piecewise smooth systems (PSS). The tool supports: 1) automatic reformulation of systems with state jumps into PSS (via the time-freezing reformulation [Nurkanović et al., 2021]) and of PSS into computationally more convenient forms, 2) automatic discretization of the OCP via, e.g., the recently introduced Finite Elements with Switch Detection [Nurkanović et al., 2022] which enables high accuracy optimal control and simulation of PSS, 3) solution methods for the resulting discrete-time OCP. The nonsmooth discrete-time OCP are solved with techniques of continuous optimization in a homotopy procedure, without the use of integer variables. This enables the treatment of a broad c",2022,arXiv,Armin Nurkanović; Moritz Diehl,10.1109/lcsys.2022.3181800,2203.11516v2,http://arxiv.org/abs/2203.11516v2,arxiv,hybrid systems robot control manipulation,anti_myopia,control,,,hybrid systems; benchmark,2026-06-12T15:07:36Z,12.850,17.850
doi:10.1177/0278364919872545,Learning task-oriented grasping for tool manipulation from simulated self-supervision,"Tool manipulation is vital for facilitating robots to complete challenging task goals. It requires reasoning about the desired effect of the task and, thus, properly grasping and manipulating the tool to achieve the task. Most work in robotics has focused on task-agnostic grasping, which optimizes for only grasp robustness without considering the subsequent manipulation tasks. In this article, we propose the Task-Oriented Grasping Network (TOG-Net) to jointly optimize both task-oriented grasping of a tool and the manipulation policy for that tool. The training process of the model is based on large-scale simulated self-supervision with procedurally generated tool objects. We perform both simulated and real-world experiments on two tool-based manipulation tasks: sweeping and hammering. Our model achieves overall 71.1% task success rate for sweeping and 80.0% task success rate for hammerin",2020,The International Journal of Robotics Research,Kuan Fang; Yuke Zhu; Animesh Garg; Andrey Kurenkov; Viraj Mehta; Li Fei-Fei; Silvio Savarese,10.1177/0278364919872545,,https://doi.org/10.1177/0278364919872545,crossref,physical reasoning robotics manipulation,concept,physical_reasoning,,138,robustness,2026-06-12T15:07:36Z,15.767,17.767
doi:10.1016/j.cogdev.2015.06.002,The roles of observation and manipulation in learning to use a tool,,2015,Cognitive Development,Eszter Somogyi; Cecilia Ara; Eugenia Gianni; Lauriane Rat-Fischer; Patrizia Fattori; J. Kevin O’Regan; Jacqueline Fagard,10.1016/j.cogdev.2015.06.002,,https://doi.org/10.1016/j.cogdev.2015.06.002,crossref,contact rich manipulation learning,concept,contact,,9,contact rich manipulation,2026-06-12T15:07:36Z,17.751,17.751
doi:10.1016/b978-012078147-8/50060-8,Environmental manipulation for microbial control of insects,,1998,Conservation Biological Control,James R. Fuxa,10.1016/b978-012078147-8/50060-8,,https://doi.org/10.1016/b978-012078147-8/50060-8,crossref,optimal control robot manipulation,anti_myopia,anti_thesis,,20,robot manipulation; optimal control robot manipulation,2026-06-12T15:07:36Z,13.722,17.722
arxiv:2112.03227v4,CALVIN: A Benchmark for Language-Conditioned Policy Learning for Long-Horizon Robot Manipulation Tasks,"General-purpose robots coexisting with humans in their environment must learn to relate human language to their perceptions and actions to be useful in a range of daily tasks. Moreover, they need to acquire a diverse repertoire of general-purpose skills that allow composing long-horizon tasks by following unconstrained language instructions. In this paper, we present CALVIN (Composing Actions from Language and Vision), an open-source simulated benchmark to learn long-horizon language-conditioned tasks. Our aim is to make it possible to develop agents that can solve many robotic manipulation tasks over a long horizon, from onboard sensors, and specified only via human language. CALVIN tasks are more complex in terms of sequence length, action space, and language than existing vision-and-language task datasets and supports flexible specification of sensor suites. We evaluate the agents in ",2021,arXiv,Oier Mees; Lukas Hermann; Erick Rosete-Beas; Wolfram Burgard,,2112.03227v4,http://arxiv.org/abs/2112.03227v4,arxiv,vision language action model limitation robotics,hostile,failure,,,vision language action model; robot manipulation; imitation learning; limitation; benchmark; long horizon,2026-06-12T14:45:03Z,11.700,17.700
