uid,title,abstract,year,venue,authors,doi,arxiv_id,url,source,query,query_role,family,advisor_seed,citation_count,matched_terms,retrieved_at,relevance_score,hostile_score
doi:10.3390/s26113541,Sensing the Action: Rethinking Sensor Modalities and Multi-Modal Fusion in Vision–Language–Action Models for Robotic Manipulation,"Recent Vision–Language–Action (VLA) models have rapidly emerged as general-purpose robotic policies that integrate language understanding, visual perception, and robot control. However, prior studies and surveys have primarily emphasized backbone architectures, action decoders, training recipes, and benchmark performance, whereas relatively limited systematic attention has been given to sensor modality selection, heterogeneous signal alignment and fusion, and their connection to action generation, all of which are critical to the performance and safety of real-world robotic manipulation. This survey addresses this gap by reinterpreting VLA within the framework of a sensor–fusion–action pipeline. This study first presents a systematic taxonomy of major sensor modalities, including RGB, depth, tactile sensing, force/torque, proprioception and inertial measurement unit, multi-spectral/therm",2026,Sensors,Byoung Chul Ko,10.3390/s26113541,,https://doi.org/10.3390/s26113541,crossref,vision language action model limitation robotics,hostile,failure,,,vision language action model; proprioception; teleoperation; failure mode; limitation; benchmark; robustness; deployment; latency,2026-06-12T14:45:03Z,9.950,18.950
doi:10.3390/s26103140,Uncertainty-Calibrated Safety Gating for Vision–Language– Action Manipulation Under Domain Shift: Reliability Gains and Intervention–Efficiency Trade-Offs,"Vision–Language–Action (VLA) policies promise flexible long-horizon manipulation, but deployment under domain shift requires both reliable uncertainty estimates and a workable runtime-assurance policy. We study a model-agnostic uncertainty-calibrated safety-gating wrapper that estimates online failure risk and routes control among policy execution, pause-and-reobserve, and a fallback planner. Using a cleaned and consistently aggregated benchmark pipeline, we evaluate two long-horizon manipulation tasks in NVIDIA Isaac Sim 5.0 under lighting, texture, occlusion, sensor, and combined shifts. Relative to an ungated VLA baseline, calibrated gating improves mean shifted success from 57.5% to 77.2% and reduces aggregate expected calibration error from 0.303 to 0.100. The largest success gains occur under occlusion and combined shift, including improvements from 48.3% to 85.2% on the drawer tas",2026,Sensors,Atef M. Ghaleb; Ali S. Allahloh; Sobhi Mejjaouli; Mohammed A. H. Ali; Adel Al-Shayea,10.3390/s26103140,,https://doi.org/10.3390/s26103140,crossref,vision language action model limitation robotics,hostile,failure,,,vision language action model; limitation; benchmark; robustness; occlusion; distribution shift; deployment; long horizon,2026-06-12T15:07:36Z,9.950,18.950
doi:10.3390/electronics15112451,Benchmarking Large Language Model Inference on Limited-Resource Edge Systems,"Large language models (LLMs) are increasingly considered for deployment on edge and limited-resource systems, where local inference can reduce latency, improve privacy, and decrease dependence on cloud infrastructure. While prior studies have evaluated either task accuracy or hardware efficiency in isolation, few benchmarks combine generation-based response-quality evaluation with real-device power measurements on a representative limited-resource platform. This study addresses that gap by benchmarking twelve compact and mid-scale open-weight LLMs (sub-1B to 8B parameters), evaluating generation-based accuracy on a desktop platform and measuring deployment efficiency—throughput, power consumption, and energy use—on an NVIDIA Jetson Orin Nano Super; the accuracy–efficiency trade-off is thus established at the model-configuration level. Unlike prior Jetson-based evaluations relying solely ",2026,Electronics,Henrikas Giedra; Dalius Matuzevičius; Tomyslav Sledevič; Giga Shubitidze; Artūras Serackis,10.3390/electronics15112451,,https://doi.org/10.3390/electronics15112451,crossref,large language model limitation robot planning,anti_myopia,anti_thesis,,,limitation; benchmark; deployment; latency; large language model limitation robot planning,2026-06-12T15:07:36Z,11.900,18.900
doi:10.3389/frobt.2022.1067502,Sim-to-real via latent prediction: Transferring visual non-prehensile manipulation policies,"Reinforcement Learning has been shown to have a great potential for robotics. It demonstrated the capability to solve complex manipulation and locomotion tasks, even by learning end-to-end policies that operate directly on visual input, removing the need for custom perception systems. However, for practical robotics applications, its scarce sample efficiency, the need for huge amounts of resources, data, and computation time can be an insurmountable obstacle. One potential solution to this sample efficiency issue is the use of simulated environments. However, the discrepancy in visual and physical characteristics between reality and simulation, namely the sim-to-real gap, often significantly reduces the real-world performance of policies trained within a simulator. In this work we propose a sim-to-real technique that trains a Soft-Actor Critic agent together with a decoupled feature extr",2023,Frontiers in Robotics and AI,Carlo Rizzardo; Fei Chen; Darwin Caldwell,10.3389/frobt.2022.1067502,,https://doi.org/10.3389/frobt.2022.1067502,crossref,sim to real robot manipulation,concept,sim2real,,6,robot manipulation; sim to real transfer; sample efficiency,2026-06-12T14:45:03Z,16.873,18.873
doi:10.1111/2041-210x.13901,Deep learning as a tool for ecology and evolution,"Abstract Deep learning is driving recent advances behind many everyday technologies, including speech and image recognition, natural language processing and autonomous driving. It is also gaining popularity in biology, where it has been used for automated species identification, environmental monitoring, ecological modelling, behavioural studies, DNA sequencing and population genetics and phylogenetics, among other applications. Deep learning relies on artificial neural networks for predictive modelling and excels at recognizing complex patterns. In this review we synthesize 818 studies using deep learning in the context of ecology and evolution to give a discipline‐wide perspective necessary to promote a rethinking of inference approaches in the field. We provide an introduction to machine learning and contrast it with mechanistic inference, followed by a gentle primer on deep learning.",2022,Methods in Ecology and Evolution,Marek L. Borowiec; Rebecca B. Dikow; Paul B. Frandsen; Alexander J. McKeeken; Gabriele Valentini; Alexander E. White,10.1111/2041-210x.13901,,https://doi.org/10.1111/2041-210x.13901,openalex,energy based model robot learning,concept,ebm,,235,limitation,2026-06-12T18:05:07Z,17.832,18.832
doi:10.1109/tcds.2020.2986411,Intrinsic Motivations and Planning to Explain Tool-Use Development: A Study With a Simulated Robot Model,,2022,IEEE Transactions on Cognitive and Developmental Systems,Kristsana Seepanomwan; Daniele Caligiore; Kevin J. O'Regan; Gianluca Baldassarre,10.1109/tcds.2020.2986411,,https://doi.org/10.1109/tcds.2020.2986411,crossref,robot world model failure planning,hostile,failure,,4,robot world model; robot world model failure,2026-06-12T15:07:36Z,14.805,18.805
doi:10.18196/jrc.v3i3.14714,NFT Hydroponic Control Using Mamdani Fuzzy Inference System,"The Nutrient Film Technique (NFT) method is one of the most popular hydroponic cultivation methods. This method has advantages such as easier maintenance, faster and optimal plant growth, better use of fertilizers, and less deposition. The disadvantages of NFT include the consumption of electrical power and the faster spread of disease. Therefore, NFT requires a good nutrient control and monitoring system to save electricity and achieve optimal growth and resistance to pests and diseases. In this study, a nutrient control was designed with indicators of pH and TDS levels and equipped with an Internet of Things (IoT) based monitoring system. The control system used is the Mamdani Fuzzy Inference System. The output of the system is the active time of the pH Up, pH Down, and AB Mix nutrient pumps, which aim to normalize the pH and TDS of nutrient liquids. The experimental results show that ",2022,Journal of Robotics and Control (JRC),Indra Agustian; Bagus Imam Prayoga; Hendy Santosa; Novalio Daratha; Ruvita Faurina,10.18196/jrc.v3i3.14714,,https://doi.org/10.18196/jrc.v3i3.14714,crossref,classical control robotics,anti_myopia,anti_thesis,,9,classical control robotics,2026-06-12T15:07:36Z,14.801,18.801
arxiv:2601.07821v1,Failure-Aware RL: Reliable Offline-to-Online Reinforcement Learning with Self-Recovery for Real-World Manipulation,"Post-training algorithms based on deep reinforcement learning can push the limits of robotic models for specific objectives, such as generalizability, accuracy, and robustness. However, Intervention-requiring Failures (IR Failures) (e.g., a robot spilling water or breaking fragile glass) during real-world exploration happen inevitably, hindering the practical deployment of such a paradigm. To tackle this, we introduce Failure-Aware Offline-to-Online Reinforcement Learning (FARL), a new paradigm minimizing failures during real-world reinforcement learning. We create FailureBench, a benchmark that incorporates common failure scenarios requiring human intervention, and propose an algorithm that integrates a world-model-based safety critic and a recovery policy trained offline to prevent failures during online exploration. Extensive simulation and real-world experiments demonstrate the effec",2026,arXiv,Huanyu Li; Kun Lei; Sheng Zang; Kaizhe Hu; Yongyuan Liang; Bo An; Xiaoli Li; Huazhe Xu,,2601.07821v1,http://arxiv.org/abs/2601.07821v1,arxiv,robot foundation model failure mode,hostile,failure,,,robot foundation model; failure mode; benchmark; generalization; robustness; deployment,2026-06-12T14:45:03Z,9.800,18.800
title:progressvla progress guided diffusion policy for vision language robotic manipulation,ProgressVLA: Progress-Guided Diffusion Policy for Vision-Language Robotic Manipulation,"Most existing vision-language-action (VLA) models for robotic manipulation lack progress awareness, typically relying on hand-crafted heuristics for task termination. This limitation is particularly severe in long-horizon tasks involving cascaded sub-goals. In this work, we investigate the estimation and integration of task progress, proposing a novel model named {\textbf \vla}. Our technical contributions are twofold: (1) \emph{robust progress estimation}: We pre-train a progress estimator on large-scale, unsupervised video-text robotic datasets. This estimator achieves a low prediction residual (0.07 on a scale of $[0, 1]$) in simulation and demonstrates zero-shot generalization to unseen real-world samples, and (2) \emph{differentiable progress guidance}: We introduce an inverse dynamics world model that maps predicted action tokens into future latent visual states. These latents are ",2026,arXiv (Cornell University),Hongyu Yan; Qiwei Li; Jiaolong Yang; Yadong Mu,,,https://openalex.org/W7148177967,openalex,energy based transformer robot policy,concept,ebm_transformer,,,energy based transformer robot policy; diffusion policy; limitation; benchmark; generalization; deployment; long horizon,2026-06-12T18:05:07Z,13.700,18.700
doi:10.20944/preprints202606.0425.v1,The Evaluation Bottleneck of Vision-Language-Action Models: A Evaluation-Centric Survey,"Vision-Language-Action (VLA) models are advancing faster than the field can evaluate them reliably. Researchers use different metrics and lab-specific protocols, making it hard to tell whether reported gains reflect genuine progress or favorable evaluation choices. We present the first comprehensive benchmark-centric survey of VLA evaluation, covering 582 papers from 2023 to May 2026. We argue that a benchmark number supports a progress claim only if four conditions hold: the benchmark discriminates among top models; metrics capture the claimed capability; the procedure permits cross-paper comparison; and the inference from benchmark to deployment is valid. Current practice fails at all four. Benchmark choice is concentrated and saturated, with leading models clustering near the ceiling of dominant simulation suites. Metric reporting is one-dimensional, dominated by task success rate whi",,,Zirui Song; Huaxing Liu; Xiang Wang; Shuai Li; Xinye Li; Yuheng Ji; Lang Gao; Jinghui Zhang; Xianhui Meng; Xiaojun Chang; Xiuying Chen,10.20944/preprints202606.0425.v1,,https://doi.org/10.20944/preprints202606.0425.v1,crossref,vision language action model limitation robotics,hostile,failure,,,vision language action model; limitation; benchmark; deployment; real world evaluation,2026-06-12T15:07:36Z,9.650,18.650
doi:10.18461/ijfsd.v4i3.433,"A Latent Class Model to discover Household Food Waste Patterns in Lisbon City in Support of Food Security, Public Health and Environmental Protection","In the middle of a great world financial crisis that also affects food security, it is important to characterize the habits of households concerning the buying and wasting food. With this study we intend (1) to uncover the patterns of Portuguese citizens concerning food waste by using a mixed research approach and (2) to identify demographic factors that can influence the production of food waste and that may support initiatives towards the education of society on food waste. We used a random sample of 542 Portuguese citizens to identify consumer profiles and 18 in-depth interviews for better understanding the uncovered profiles in a mixed method research approach. Through a two-latent class model two clusters of consumers were identified: cluster 1, the Non food waste citizens with 65% of respondents, mainly 24 years or more, female and married or divorced and cluster 2, the Food waste ",2013,International Journal on Food System Dynamics,Jaime R.S. Fonseca,10.18461/ijfsd.v4i3.433,,https://doi.org/10.18461/ijfsd.v4i3.433,crossref,latent dynamics model robotics,concept,architecture,,13,latent dynamics model robotics,2026-06-12T14:45:03Z,18.620,18.620
doi:10.1109/iros60139.2025.11245978,GeT-USE: Learning Generalized Tool Usage for Bimanual Mobile Manipulation via Simulated Embodiment Extensions,,2025,2025 IEEE/RSJ International Conference on Intelligent Robots and Systems (IROS),Bohan Wu; Paul de La Sayette; Li Fei-Fei; Roberto Martín-Martín,10.1109/iros60139.2025.11245978,,https://doi.org/10.1109/iros60139.2025.11245978,crossref,contact rich manipulation learning,concept,contact,,,contact rich manipulation; mobile manipulation,2026-06-12T15:07:36Z,18.600,18.600
doi:10.3390/s25216741,DPDQN-TER: An Improved Deep Reinforcement Learning Approach for Mobile Robot Path Planning in Dynamic Scenarios,"Efficient and stable path planning in dynamic and obstacle-dense environments, such as large-scale structure assembly measurement, is essential for improving the practicality and environmental adaptability of mobile robots in measurement and quality inspection tasks. However, traditional reinforcement learning methods often suffer from inefficient use of experience and limited capability to represent policy structures in complex dynamic scenarios. To overcome these limitations, this study proposes a method named DPDQN-TER that integrates Transformer-based sequence modeling with a multi-branch parameter policy network. The proposed method introduces a temporal-aware experience replay mechanism that employs multi-head self-attention to capture causal dependencies within state transition sequences. By dynamically weighting and sampling critical obstacle-avoidance experiences, this mechanism",2025,Sensors,Shuyuan Gao; Yang Xu; Xiaoxiao Guo; Chenchen Liu; Xiaobai Wang,10.3390/s25216741,,https://doi.org/10.3390/s25216741,crossref,robot planning without learning,anti_myopia,anti_thesis,,3,limitation; benchmark; generalization; ablation; deployment; robot planning without learning,2026-06-12T15:07:36Z,9.593,18.593
doi:10.24963/ijcai.2019/869,Differentiable Physics and Stable Modes for Tool-Use and Manipulation Planning - Extended Abtract,"We propose to formulate physical reasoning and manipulation planning as an optimization problem that integrates first order logic, which we call Logic-Geometric Programming.",2019,Proceedings of the Twenty-Eighth International Joint Conference on Artificial Intelligence,Marc Toussaint; Kelsey R. Allen; Kevin A. Smith; Joshua B. Tenenbaum,10.24963/ijcai.2019/869,,https://doi.org/10.24963/ijcai.2019/869,crossref,differentiable physics robot learning,concept,architecture,,4,differentiable physics robot learning,2026-06-12T15:07:36Z,18.555,18.555
doi:10.1002/hbm.21149,Dissociation between manipulation and conceptual knowledge of object use in the supramarginalis gyrus,"Abstract Because tool naming activates motor‐related areas in the posterior parietal cortex, it has been suggested that conceptual knowledge of tools relies on their unique manipulation patterns. However, this view is questioned by the finding that some patients impaired in retrieving manipulation knowledge of man‐made objects are still able to perform conceptual judgments on them. To address this issue, we used repetitive transcranial magnetic stimulation (rTMS) to interfere with the functioning of the anterior part of the right or left supramarginalis gyrus (SMG), a region critically involved in object‐directed actions. rTMS was delivered in healthy participants performing four judgment tasks designed to explore different aspects of manipulation and conceptual knowledge of man‐made objects. The two manipulation judgment tasks consisted in determining whether (1) two objects displayed o",2011,Human Brain Mapping,Barbara Pelgrims; Etienne Olivier; Michael Andres,10.1002/hbm.21149,,https://doi.org/10.1002/hbm.21149,crossref,deformable object manipulation robot learning,concept,deformable,,42,deformable object manipulation,2026-06-12T15:07:36Z,18.531,18.531
doi:10.3389/frobt.2016.00058,"Mobile Manipulation, Tool Use, and Intuitive Interaction for Cognitive Service Robot Cosero",,2016,Frontiers in Robotics and AI,Jörg Stückler; Max Schwarz; Sven Behnke,10.3389/frobt.2016.00058,,https://doi.org/10.3389/frobt.2016.00058,crossref,robot world models manipulation,concept,world_models,,29,robot world model; mobile manipulation,2026-06-12T14:45:03Z,18.501,18.501
arxiv:2511.22904v1,Language-conditioned world model improves policy generalization by reading environmental descriptions,"To interact effectively with humans in the real world, it is important for agents to understand language that describes the dynamics of the environment--that is, how the environment behaves--rather than just task instructions specifying ""what to do"". Understanding this dynamics-descriptive language is important for human-agent interaction and agent behavior. Recent work address this problem using a model-based approach: language is incorporated into a world model, which is then used to learn a behavior policy. However, these existing methods either do not demonstrate policy generalization to unseen games or rely on limiting assumptions. For instance, assuming that the latency induced by inference-time planning is tolerable for the target task or expert demonstrations are available. Expanding on this line of research, we focus on improving policy generalization from a language-conditioned",2025,arXiv,Anh Nguyen; Stefan Lee,,2511.22904v1,http://arxiv.org/abs/2511.22904v1,arxiv,robot world models manipulation,concept,world_models,,,robot world model; generalization; deployment; latency,2026-06-12T14:45:03Z,15.500,18.500
arxiv:2605.21258v1,Learning Structural Latent Points for Efficient Visual Representations in Robotic Manipulation,"Current 3D-aware pretraining methods for embodied perception and manipulation are largely built on differentiable rendering frameworks, producing either fully implicit neural fields or fully explicit geometric primitives. Implicit representations, while expressive, lack explicit structural cues, whereas explicit ones preserve geometry but suffer from resolution limits and weak generalization. To address these limitations, we propose a novel pretraining framework that learns a hybrid representation-structural latent points. Specifically, we insert a point-wise latent variational autoencoder into the latent space of a point-cloud autoencoder, jointly regularizing point-wise features and coordinates toward a Gaussian prior. The resulting compact latent preserves coarse structural tendencies, which do not encode precise geometry but capture richer rough shape and semantic information, effect",2026,arXiv,Yicheng Jiang; Jiaxu Wang; Junhao He; Zesen Gan; Junhao Li; Qiang Zhang; Jingkai Sun; Jiahang Cao; Mingyuan Sun; Xiangyu Yue; Qiming Shao,,2605.21258v1,http://arxiv.org/abs/2605.21258v1,arxiv,latent dynamics model robotics,concept,architecture,,,latent dynamics model robotics; limitation; generalization; robustness; sample efficiency; ablation,2026-06-12T14:45:03Z,14.500,18.500
arxiv:2512.11769v1,BLURR: A Boosted Low-Resource Inference for Vision-Language-Action Models,"Vision-language-action (VLA) models enable impressive zero shot manipulation, but their inference stacks are often too heavy for responsive web demos or high frequency robot control on commodity GPUs. We present BLURR, a lightweight inference wrapper that can be plugged into existing VLA controllers without retraining or changing model checkpoints. Instantiated on the pi-zero VLA controller, BLURR keeps the original observation interfaces and accelerates control by combining an instruction prefix key value cache, mixed precision execution, and a single step rollout schedule that reduces per step computation. In our SimplerEnv based evaluation, BLURR maintains task success rates comparable to the original controller while significantly lowering effective FLOPs and wall clock latency. We also build an interactive web demo that allows users to switch between controllers and toggle inference",2025,arXiv,Xiaoyu Ma; Zhengqing Yuan; Zheyuan Zhang; Kaiwen Shi; Lichao Sun; Yanfang Ye,,2512.11769v1,http://arxiv.org/abs/2512.11769v1,arxiv,vision language action model limitation robotics,hostile,failure,,,vision language action model; limitation; latency,2026-06-12T14:45:03Z,12.500,18.500
doi:10.1016/j.eehl.2024.01.006,"A new ChatGPT-empowered, easy-to-use machine learning paradigm for environmental science","The quantity and complexity of environmental data show exponential growth in recent years. High-quality big data analysis is critical for performing a sophisticated characterization of the complex network of environmental pollution. Machine learning (ML) has been employed as a powerful tool for decoupling the complexities of environmental big data based on its remarkable fitting ability. Yet, due to the knowledge gap across different subjects, ML concepts and algorithms have not been well-popularized among researchers in environmental sustainability. In this context, we introduce a new research paradigm-""ChatGPT + ML + Environment"", providing an unprecedented chance for environmental researchers to reduce the difficulty of using ML models. For instance, each step involved in applying ML models to environmental sustainability, including data preparation, model selection and construction, ",2024,Eco-Environment & Health,Haoyuan An; Xiangyu Li; Yuming Huang; Weichao Wang; Yuehan Wu; Lin Liu; Weibo Ling; Wei Li; Hanzhu Zhao; Dawei Lü; Qian Liu; Guibin Jiang,10.1016/j.eehl.2024.01.006,,https://doi.org/10.1016/j.eehl.2024.01.006,openalex,energy based transformer robot policy,concept,ebm_transformer,,13,energy based transformer robot policy; limitation,2026-06-12T18:05:07Z,17.470,18.470
doi:10.3390/agriculture15141523,AgriFusionNet: A Lightweight Deep Learning Model for Multisource Plant Disease Diagnosis,"Timely and accurate identification of plant diseases is critical to mitigating crop losses and enhancing yield in precision agriculture. This paper proposes AgriFusionNet, a lightweight and efficient deep learning model designed to diagnose plant diseases using multimodal data sources. The framework integrates RGB and multispectral drone imagery with IoT-based environmental sensor data (e.g., temperature, humidity, soil moisture), recorded over six months across multiple agricultural zones. Built on the EfficientNetV2-B4 backbone, AgriFusionNet incorporates Fused-MBConv blocks and Swish activation to improve gradient flow, capture fine-grained disease patterns, and reduce inference latency. The model was evaluated using a comprehensive dataset composed of real-world and benchmarked samples, showing superior performance with 94.3% classification accuracy, 28.5 ms inference time, and a 30%",2025,Agriculture,Saleh Albahli,10.3390/agriculture15141523,,https://doi.org/10.3390/agriculture15141523,openalex,energy based model robot learning,concept,ebm,,30,benchmark; generalization; robustness; ablation; deployment; latency,2026-06-12T18:05:07Z,12.417,18.417
doi:10.1007/978-3-319-31800-4_6,Manipulation of Insect Reproductive Systems as a Tool in Pest Control,,2016,Advances in Insect Control and Resistance Management,Ally R. Harari; Rakefet Sharon; Phyllis G. Weintraub,10.1007/978-3-319-31800-4_6,,https://doi.org/10.1007/978-3-319-31800-4_6,crossref,hybrid systems robot control manipulation,anti_myopia,control,,6,hybrid systems,2026-06-12T15:07:36Z,15.373,18.373
