uid,title,abstract,year,venue,authors,doi,arxiv_id,url,source,query,query_role,family,advisor_seed,citation_count,matched_terms,retrieved_at,relevance_score,hostile_score
arxiv:2602.20466v1,Grasp to Act: Dexterous Grasping for Tool Use in Dynamic Settings,"Achieving robust grasping with dexterous hands remains challenging, especially when manipulation involves dynamic forces such as impacts, torques, and continuous resistance--situations common in real-world tool use. Existing methods largely optimize grasps for static geometric stability and often fail once external forces arise during manipulation. We present Grasp-to-Act, a hybrid system that combines physics-based grasp optimization with reinforcement-learning-based grasp adaptation to maintain stable grasps throughout functional manipulation tasks. Our method synthesizes robust grasp configurations informed by human demonstrations and employs an adaptive controller that residually issues joint corrections to prevent in-hand slip while tracking the object trajectory. Grasp-to-Act enables robust zero-shot sim-to-real transfer across five dynamic tool-use tasks--hammering, sawing, cuttin",2026,arXiv,Harsh Gupta; Mohammad Amin Mirzaee; Wenzhen Yuan,,2602.20466v1,http://arxiv.org/abs/2602.20466v1,arxiv,analytical grasping,anti_myopia,anti_thesis,,,sim to real transfer; human demonstration; analytical grasping,2026-06-12T15:07:36Z,19.800,24.800
doi:10.3390/sym18030394,PI-VLA: Adaptive Symmetry-Aware Decision-Making for Long-Horizon Vision–Language–Action Manipulation,"Vision–language–action (VLA) models often suffer from limited robustness in long-horizon manipulation tasks—where robots must execute extended sequences of actions over multiple time steps to achieve complex goals—due to their inability to explicitly exploit structural symmetries and to react adaptively when such symmetries are violated by environmental uncertainty. To address this limitation, this paper proposes PI-VLA, a symmetry-aware predictive and interactive VLA framework for robust robotic manipulation. PI-VLA is built upon three key symmetry-driven principles. First, a Cognitive–Motor Synergy (CMS) module jointly generates discrete and continuous action chunks together with predictive world-model features in a single forward pass, enforcing cross-modal action consistency as an implicit symmetry constraint across heterogeneous action representations. Second, a unified training obj",2026,Symmetry,Yina Jian; Di Tian; Xuan-Jing Chen; Zhen-Yuan Wei; Chen-Wei Liang; Mu-Jiang-Shan Wang,10.3390/sym18030394,,https://doi.org/10.3390/sym18030394,crossref,vision language action model limitation robotics,hostile,failure,,2,vision language action model; imitation learning; limitation; benchmark; robustness; ablation; long horizon,2026-06-12T15:07:36Z,12.849,21.849
doi:10.1002/adrr.202500142,A State‐Adaptive Koopman Control Framework for Real‐Time Deformable Tool Manipulation in Robotic Environmental Swabbing,"Deformable object manipulation (DOM) remains a critical challenge in robotics due to thecomplexities of developing suitable model‐based control strategies. Deformable tool manipulation (DTM) further complicates this task by introducing additional uncertainties between the robot and its environment. While humans effortlessly manipulate deformable tools using touch and experience, robotic systems struggle to maintain stability and precision. These challenges are particularly evident in environmental swab sampling for food safety, where a soft, sponge‐tipped swab must maintain prescribed normal force and uniform surface coverage. To address these challenges, we adapt a state‐adaptive Koopman‐based linear quadratic regulator (SA‐KLQR) control framework for real‐time deformable swabbing tool manipulation, demonstrated in environmental swab sampling for food safety. This method leverages Koopm",2026,Advanced Robotics Research,Siavash Mahmoudi; Amirreza Davar; Dongyi Wang,10.1002/adrr.202500142,,https://doi.org/10.1002/adrr.202500142,crossref,sim to real robot manipulation,concept,sim2real,,,robot manipulation; deformable object manipulation,2026-06-12T14:45:03Z,19.650,20.650
doi:10.1007/s10846-026-02392-y,PLATO: Planning with LLMs and Affordances for Tool Manipulation,"Abstract As robotic systems become increasingly integrated into complex real-world environments, there is a growing need for approaches that enable robots to understand and act on natural language instructions without extensive pre-programmed knowledge. This paper presents PLATO, a system that addresses this challenge by leveraging specialized large language model agents to process language inputs, understand the environment, predict tool affordances, and generate executable actions. Unlike traditional systems that depend on hard-coded environmental information, PLATO employs a modular agent-based architecture that operates without any initial knowledge of the environment. These agents identify objects and their locations, generate a high-level plan, translate it into low-level actions, and verify successful execution. The system is tested particularly on challenging tool-use tasks, whic",2026,Journal of Intelligent & Robotic Systems,Arvind Car; Sai Yarlagadda; Alison Bartsch; Abraham George; Amir Barati Farimani,10.1007/s10846-026-02392-y,,https://doi.org/10.1007/s10846-026-02392-y,crossref,robot world models manipulation,concept,world_models,,,robot world model; robustness; long horizon,2026-06-12T15:07:36Z,18.650,20.650
arxiv:2601.15197v7,LangForce: Bayesian Decomposition of Vision Language Action Models via Latent Action Queries,"Vision-Language-Action (VLA) models have shown promise in robot manipulation but often struggle to generalize to new instructions or complex multi-task scenarios. We identify a critical pathology in current training paradigms where goal-driven data collection creates a dataset bias. In such datasets, language instructions are highly predictable from visual observations alone, causing the conditional mutual information between instructions and actions to vanish, a phenomenon we term Information Collapse. Consequently, models degenerate into vision-only policies that ignore language constraints and fail in out-of-distribution (OOD) settings. To address this, we propose LangForce, a novel framework that enforces instruction following via Bayesian decomposition. By introducing learnable Latent Action Queries, we construct a dual-branch architecture to estimate both a vision-only prior $p(a \",2026,arXiv,Shijie Lian; Bin Yu; Xiaopeng Lin; Laurence T. Yang; Zhaolong Shen; Changti Wu; Yuzhuo Miao; Cong Huang; Kai Chen,,2601.15197v7,http://arxiv.org/abs/2601.15197v7,arxiv,vision language action model limitation robotics,hostile,failure,,,vision language action model; robot manipulation; limitation; benchmark; generalization; out of distribution,2026-06-12T14:45:03Z,12.500,20.500
arxiv:2511.05397v1,EveryDayVLA: A Vision-Language-Action Model for Affordable Robotic Manipulation,"While Vision-Language-Action (VLA) models map visual inputs and language instructions directly to robot actions, they often rely on costly hardware and struggle in novel or cluttered scenes. We introduce EverydayVLA, a 6-DOF manipulator that can be assembled for under $300, capable of modest payloads and workspace. A single unified model jointly outputs discrete and continuous actions, and our adaptive-horizon ensemble monitors motion uncertainty to trigger on-the-fly re-planning for safe, reliable operation. On LIBERO, EverydayVLA matches state-of-the-art success rates, and in real-world tests it outperforms prior methods by 49% in-distribution and 34.9% out-of-distribution. By combining a state-of-the-art VLA with cost-effective hardware, EverydayVLA democratizes access to a robotic foundation model and paves the way for economical use in homes and research labs alike. Experiment video",2025,arXiv,Samarth Chopra; Alex McMoil; Ben Carnovale; Evan Sokolson; Rajkumar Kubendran; Samuel Dickerson,,2511.05397v1,http://arxiv.org/abs/2511.05397v1,arxiv,vision language action model limitation robotics,hostile,failure,,,vision language action model; limitation; out of distribution,2026-06-12T14:45:03Z,12.150,20.150
doi:10.2139/ssrn.6460223,Object Manipulation Scaffolds the Development of Tool Use in Children,"Our species’ extensive reliance on tool use is a key aspect of what makes us human, yet naturalistic data on the social and environmental drivers of tool use development in children remain scarce. We examined the drivers of tool use in naturalistic observations of 31 children in Swiss daycares (ages 0.5–4.5 years, 17 females, N=447 video follows). All children frequently engaged with objects. Simple object manipulation bouts became shorter with age, and the number of complex tool use bouts increased. Social learning opportunities increased the frequency of material engagement, whereas the mere presence of others reduced it. Higher object availability predicted both higher frequency and complexity of material engagement. In sum, children were intrinsically motivated to manipulate objects, but environmental and social influences further shaped tool use development. Our naturalistic study p",,,Ellen Soeters; Jake  A. Funkhouser; Erik  P. Willems; Crickette Sanz; Kathelijne Koops,10.2139/ssrn.6460223,,https://doi.org/10.2139/ssrn.6460223,crossref,deformable object manipulation robot learning,concept,deformable,,,deformable object manipulation,2026-06-12T15:07:36Z,20.000,20.000
arxiv:2409.12514v5,"TinyVLA: Towards Fast, Data-Efficient Vision-Language-Action Models for Robotic Manipulation","Vision-Language-Action (VLA) models have shown remarkable potential in visuomotor control and instruction comprehension through end-to-end learning processes. However, current VLA models face significant challenges: they are slow during inference and require extensive pre-training on large amounts of robotic data, making real-world deployment difficult. In this paper, we introduce a new family of compact vision-language-action models, called TinyVLA, which offers two key advantages over existing VLA models: (1) faster inference speeds, and (2) improved data efficiency, eliminating the need for pre-training stage. Our framework incorporates two essential components to build TinyVLA: (1) initializing the policy backbone with robust, high-speed multimodal models, and (2) integrating a diffusion policy decoder during fine-tuning to enable precise robot actions. We conducted extensive evaluat",2024,arXiv,Junjie Wen; Yichen Zhu; Jinming Li; Minjie Zhu; Kun Wu; Zhiyuan Xu; Ning Liu; Ran Cheng; Chaomin Shen; Yaxin Peng; Feifei Feng; Jian Tang,,2409.12514v5,http://arxiv.org/abs/2409.12514v5,arxiv,vision language action model limitation robotics,hostile,failure,,,vision language action model; diffusion policy; limitation; generalization; data efficiency; deployment,2026-06-12T14:45:03Z,11.950,19.950
doi:10.1109/tase.2024.3370139,A Dynamic Movement Primitives-Based Tool Use Skill Learning and Transfer Framework for Robot Manipulation,,2025,IEEE Transactions on Automation Science and Engineering,Zhenyu Lu; Ning Wang; Chenguang Yang,10.1109/tase.2024.3370139,,https://doi.org/10.1109/tase.2024.3370139,crossref,robot world models manipulation,concept,world_models,,12,robot world model; robot manipulation; skill learning,2026-06-12T15:07:36Z,19.882,19.882
doi:10.3390/sym16040434,The Relation between Infants’ Manual Lateralization and Their Performance of Object Manipulation and Tool Use,"Previous research yielded inconsistent findings regarding whether manual lateralization (e.g., a distinct and consistent hand preference) affects manual performance during infancy and early childhood. The aim of the current study was to determine whether manual lateralization, viewed as a marker of hemispheric lateralization, is associated with infants’ performance in role-differentiated bimanual manipulation (RDBM) and tool use. This longitudinal study assessed 158 typically developing infants (91 males, aged 9.13 ± 0.15 months at baseline) monthly during the 9–14-month period. Developmental trajectories for manual lateralization in object acquisition were related to those for RDBM and tool use, even after accounting for potential sex differences. All statistical analyses were conducted using Hierarchical Linear Modeling software (version 6). Advanced RDBM performance was associated wit",2024,Symmetry,Iryna Babik; Kylie Llamas; George F. Michel,10.3390/sym16040434,,https://doi.org/10.3390/sym16040434,crossref,deformable object manipulation robot learning,concept,deformable,,1,bimanual manipulation; deformable object manipulation,2026-06-12T15:07:36Z,19.797,19.797
doi:10.15607/rss.2018.xiv.044,Differentiable Physics and Stable Modes for Tool-Use and Manipulation Planning,,2018,Robotics: Science and Systems XIV,Marc Toussaint; Kelsey Allen; Kevin Smith; Joshua Tenenbaum,10.15607/rss.2018.xiv.044,,https://doi.org/10.15607/rss.2018.xiv.044,crossref,differentiable physics robot learning,concept,architecture,,169,differentiable physics robot learning,2026-06-12T14:45:03Z,19.768,19.768
doi:10.3390/app9061072,A Latent State-Based Multimodal Execution Monitor with Anomaly Detection and Classification for Robot Introspection,"Robot introspection is expected to greatly aid longer-term autonomy of autonomous manipulation systems. By equipping robots with abilities that allow them to assess the quality of their sensory data, robots can detect and classify anomalies and recover appropriately from common anomalies. This work builds on our previous Sense-Plan-Act-Introspect-Recover (SPAIR) system. We introduce an improved anomaly detector that exploits latent states to monitor anomaly occurrence when robots collaborate with humans in shared workspaces, but also present a multiclass classifier that is activated with anomaly detection. Both implementations are derived from Bayesian non-parametric methods with strong modeling capabilities for learning and inference of multivariate time series with complex and uncertain behavior patterns. In particular, we explore the use of a hierarchical Dirichlet stochastic process ",2019,Applied Sciences,Hongmin Wu; Yisheng Guan; Juan Rojas,10.3390/app9061072,,https://doi.org/10.3390/app9061072,crossref,latent dynamics model robot control,concept,latent_dynamics,,21,robustness,2026-06-12T15:07:36Z,18.696,19.696
doi:10.3390/math14091566,"A New One-Parameter Model Supports an Upside-Down Bathtub Failure Rate: Theory, Inference, and Real-World Applications","Researchers often develop ordinal hazard distributions, whether increasing or decreasing, into multi-parameter distributions to derive various forms of the hazard function. This process necessitates the formulation of a multi-parameter hazard function, which involves a more complex mathematical expression. In contrast, this study introduces a new one-parameter lifetime model, termed the Inverted Z–Lindley (IZL) distribution, which is capable of capturing an upside-down bathtub-shaped failure rate without sacrificing analytical simplicity. Fundamental distributional properties of the IZL model are rigorously established, including closed-form expressions for the probability density, cumulative distribution, reliability, and hazard rate functions. Theoretical analysis shows that the density is strictly positive, unimodal, positively skewed, and heavy-tailed, while the hazard rate is unimod",2026,Mathematics,Ohud A. Alqasem; Ahmed Elshahhat,10.3390/math14091566,,https://doi.org/10.3390/math14091566,crossref,robot world model failure planning,hostile,failure,,,robot world model; robot world model failure,2026-06-12T15:07:36Z,14.600,19.600
doi:10.1037/rev0000027,Tool use and affordance: Manipulation-based versus reasoning-based approaches.,,2016,Psychological Review,François Osiurak; Arnaud Badets,10.1037/rev0000027,,https://doi.org/10.1037/rev0000027,crossref,physical reasoning robotics manipulation,concept,physical_reasoning,,169,,2026-06-12T14:45:03Z,19.368,19.368
doi:10.71465/csb207,SEMANTIC-PRESERVING WATERMARK INJECTION FOR LARGE LANGUAGE MODELS THROUGH LATENT SPACE MANIPULATION,"The proliferation of Large Language Models (LLMs) has raised critical concerns regarding intellectual property protection and content authentication in the era of artificial intelligence. This research proposes a novel watermarking framework that operates within the latent space of LLMs to embed imperceptible ownership signatures while maintaining semantic integrity. Unlike conventional post-generation watermarking approaches, our method manipulates intermediate representations during the model's inference phase, achieving a delicate balance betweenwatermark robustness and output quality preservation. The proposed technique leverages the geometric properties of high-dimensional embedding spaces to identify semantically neutral subspaces where watermark information can be encoded without disrupting the model's linguistic capabilities. Through extensive experimentation on multiple benchmar",2026,Computer Science Bulletin,Jae-min Park; Rina Okamoto,10.71465/csb207,,https://doi.org/10.71465/csb207,crossref,robot world models manipulation,concept,world_models,,,robot world model; benchmark; robustness; deployment; latency,2026-06-12T15:07:36Z,16.300,19.300
doi:10.1609/aaai.v40i22.38896,GraphCoT-VLA: A 3D Spatial-Aware Reasoning Vision-Language-Action Model for Robotic Manipulation with Ambiguous Instructions,"Vision-language-action models have emerged as a crucial paradigm in robotic manipulation. However, existing VLA models exhibit notable limitations in handling ambiguous language instructions and unknown environmental states. Furthermore, their perception is largely constrained to static two-dimensional observations, lacking the capability to model three-dimensional interactions between the robot and its environment. To address these challenges, this paper proposes GraphCoT-VLA, an efficient end-to-end model. To enhance the model's ability to interpret ambiguous instructions and improve task planning, we design a structured Chain-of-Thought reasoning module that integrates high-level task understanding and planning, failed task feedback, and low-level imaginative reasoning about future object positions and robot actions. Additionally, we construct a real-time updatable 3D Pose-Object grap",2026,Proceedings of the AAAI Conference on Artificial Intelligence,Helong Huang; Min Cen; Kai Tan; Xingyue Quan; Guowei Huang; Hong Zhang,10.1609/aaai.v40i22.38896,,https://doi.org/10.1609/aaai.v40i22.38896,crossref,vision language action model limitation robotics,hostile,failure,,,vision language action model; limitation; generalization; robustness,2026-06-12T14:45:03Z,12.300,19.300
arxiv:2411.19650v1,CogACT: A Foundational Vision-Language-Action Model for Synergizing Cognition and Action in Robotic Manipulation,"The advancement of large Vision-Language-Action (VLA) models has significantly improved robotic manipulation in terms of language-guided task execution and generalization to unseen scenarios. While existing VLAs adapted from pretrained large Vision-Language-Models (VLM) have demonstrated promising generalizability, their task performance is still unsatisfactory as indicated by the low tasks success rates in different environments. In this paper, we present a new advanced VLA architecture derived from VLM. Unlike previous works that directly repurpose VLM for action prediction by simple action quantization, we propose a omponentized VLA architecture that has a specialized action module conditioned on VLM output. We systematically study the design of the action module and demonstrates the strong performance enhancement with diffusion action transformers for action sequence modeling, as wel",2024,arXiv,Qixiu Li; Yaobo Liang; Zeyu Wang; Lin Luo; Xi Chen; Mozheng Liao; Fangyun Wei; Yu Deng; Sicheng Xu; Yizhong Zhang; Xiaofan Wang; Bei Liu; Jianlong Fu; Jianmin Bao; Dong Chen; Yuanchun Shi; Jiaolong Yang; Baining Guo,,2411.19650v1,http://arxiv.org/abs/2411.19650v1,arxiv,vision language action model limitation robotics,hostile,failure,,,vision language action model; action transformer; limitation; generalization; ablation,2026-06-12T14:45:03Z,12.300,19.300
doi:10.20944/preprints202601.0682.v1,PI-VLA: A Symmetry-Aware Predictive and Interactive Vision--Language--Action Framework for Robust Robotic Manipulation,"Vision–language–action (VLA) models often suffer from limited robustness in long-horizon manipulation tasks due to their inability to explicitly exploit structural symmetries and to react adaptively when such symmetries are violated by environmental uncertainty. To address this limitation, this paper proposes PI-VLA, a symmetry-aware predictive and interactive VLA framework for robust robotic manipulation. PI-VLA is built upon three key symmetry-driven principles. First, a Cognitive–Motor Synergy (CMS) module jointly generates discrete and continuous action chunks together with predictive world-model features in a single forward pass, enforcing cross-modal action consistency as an implicit symmetry constraint across heterogeneous action representations. Second, a unified training objective integrates imitation learning, reinforcement learning, and state prediction, encouraging invariance",,,Yina Jian; Tian Di; Zhen-Yuan Wei; Chen-Wei Liang; Mu-Jiang-Shan Wang,10.20944/preprints202601.0682.v1,,https://doi.org/10.20944/preprints202601.0682.v1,crossref,vision language action model limitation robotics,hostile,failure,,,vision language action model; imitation learning; limitation; benchmark; robustness; ablation; long horizon,2026-06-12T15:07:36Z,10.300,19.300
doi:10.32920/32253735.v1,Development and Evaluation of a Vision-Language Guided Robotic Manipulation Pipeline,"This thesis presents the development of a semantic-to-metric robotic manipulation pipeline that integrates Vision-Language Models (VLMs) with classical computer vision-based pose estimation. The system converts natural language instructions into motion commands through a modular workflow consisting of semantic object selection, fiducial marker-based pose estimation, and camera-frame command generation. Three VLM configurations were evaluated: a locally deployed LLaVA-1.5-7b model with a three-pass closed-set wrapper, a LLaVA-1.6-mistral-7b candidate upgrade, and a cloud-based Gemini model. Performance was assessed using metrics relevant to robot deployment, including inference latency, structured output compliance, decision accuracy, ambiguity handling, and robustness to prompt variation. Experimental results show that cloud-based inference achieves the highest accuracy and the lowest la",,,Jayden Vellozo,10.32920/32253735.v1,,https://doi.org/10.32920/32253735.v1,crossref,vision language action model limitation robotics,hostile,failure,,,vision language action model; limitation; robustness; deployment; latency,2026-06-12T15:07:36Z,10.300,19.300
doi:10.32920/32253735,Development and Evaluation of a Vision-Language Guided Robotic Manipulation Pipeline,"This thesis presents the development of a semantic-to-metric robotic manipulation pipeline that integrates Vision-Language Models (VLMs) with classical computer vision-based pose estimation. The system converts natural language instructions into motion commands through a modular workflow consisting of semantic object selection, fiducial marker-based pose estimation, and camera-frame command generation. Three VLM configurations were evaluated: a locally deployed LLaVA-1.5-7b model with a three-pass closed-set wrapper, a LLaVA-1.6-mistral-7b candidate upgrade, and a cloud-based Gemini model. Performance was assessed using metrics relevant to robot deployment, including inference latency, structured output compliance, decision accuracy, ambiguity handling, and robustness to prompt variation. Experimental results show that cloud-based inference achieves the highest accuracy and the lowest la",,,Jayden Vellozo,10.32920/32253735,,https://doi.org/10.32920/32253735,crossref,vision language action model limitation robotics,hostile,failure,,,vision language action model; limitation; robustness; deployment; latency,2026-06-12T15:07:36Z,10.300,19.300
arxiv:2512.01946v3,Scaling Cross-Environment Failure Reasoning Data for Vision-Language Robotic Manipulation,"Robust robotic manipulation requires reliable failure detection and recovery. Although recent Vision-Language Models (VLMs) show promise in robot failure detection, their generalization is severely limited by the scarcity and narrow coverage of failure data. To address this bottleneck, we propose an automatic framework for generating diverse robotic planning and execution failures across both simulated and real-world environments. Our approach perturbs successful manipulation trajectories to synthesize failures that reflect realistic failure distributions, and leverages VLMs to produce structured step-by-step reasoning traces. This yields FailCoT, a large-scale failure reasoning dataset built upon the RLBench simulator and the BridgeDataV2 real-robot dataset. Using FailCoT, we train Guardian, a multi-view reasoning VLM for unified planning and execution verification. Guardian achieves st",2025,arXiv,Paul Pacaud; Ricardo Garcia; Shizhe Chen; Cordelia Schmid,,2512.01946v3,http://arxiv.org/abs/2512.01946v3,arxiv,robot world model failure planning,hostile,failure,,,robot world model; failure detection; benchmark; generalization; deployment; robot world model failure,2026-06-12T14:45:03Z,10.150,19.150
