uid,title,abstract,year,venue,authors,doi,arxiv_id,url,source,query,query_role,family,advisor_seed,citation_count,matched_terms,retrieved_at,relevance_score,hostile_score
doi:10.1109/tcad.2024.3443692,EQ-ViT: Algorithm-Hardware Co-Design for End-to-End Acceleration of Real-Time Vision Transformer Inference on Versal ACAP Architecture,"While Vision Transformers (ViTs) have shown consistent progress in computer vision, deploying them for real-time decision-making scenarios (< 1 ms) is challenging. Current computing platforms like CPUs, GPUs, or FPGA-based solutions struggle to meet this deterministic low-latency real-time requirement, even with quantized ViT models. Some approaches use pruning or sparsity to reduce model size and latency, but this often results in accuracy loss. To address the aforementioned constraints, in this work, we propose EQ-ViT, an end-to-end acceleration framework with novel algorithm and architecture co-design features to enable real-time ViT acceleration on AMD Versal Adaptive Compute Acceleration Platform (ACAP). The contributions are four-fold. First, we perform in-depth kernel-level performance profiling & analysis and explain the bottlenecks for existing acceleration solutions on GPU, FPG",2024,IEEE Transactions on Computer-Aided Design of Integrated Circuits and Systems,Peiyan Dong; Jinming Zhuang; Zhuoping Yang; Shixin Ji; Yanyu Li; Dongkuan Xu; Heng Huang; Jingtong Hu; Alex K. Jones; Yiyu Shi; Yanzhi Wang; Peipei Zhou,10.1109/tcad.2024.3443692,,https://doi.org/10.1109/tcad.2024.3443692,openalex,energy based transformer robot policy,concept,ebm_transformer,,24,energy based transformer robot policy; latency,2026-06-12T18:05:07Z,12.409,12.409
doi:10.4108/icst.valuetools.2013.254407,A tool for symbolic manipulation of arc functions in Symmetric Net models,,2014,Proceedings of the 7th International Conference on Performance Evaluation Methodologies and Tools,Giuliana Franceschinis; Lorenzo Capra; Massimiliano De Pierro,10.4108/icst.valuetools.2013.254407,,https://doi.org/10.4108/icst.valuetools.2013.254407,crossref,robot world models manipulation,concept,world_models,,4,robot world model,2026-06-12T15:07:36Z,12.405,13.405
doi:10.1115/dscc2012-movic2012-8685,Achieving Dexterous Manipulation for Minimally Invasive Surgical Robots Through the Use of Hydraulics,,2012,"Volume 3: Renewable Energy Systems; Robotics; Robust Control; Single Track Vehicle Dynamics and Control; Stochastic Models, Control and Algorithms in Robotics; Structure Dynamics and Smart Structures;",Devin R. Berg; Perry Y. Li; Arthur G. Erdman,10.1115/dscc2012-movic2012-8685,,https://doi.org/10.1115/dscc2012-movic2012-8685,crossref,physical reasoning robotics manipulation,concept,physical_reasoning,,4,dexterous manipulation; surgical robot,2026-06-12T15:07:36Z,12.405,12.405
doi:10.1007/s11222-006-9015-6,Model fitting and inference under latent equilibrium processes,,2007,Statistics and Computing,Sourabh Bhattacharya; Alan E. Gelfand; Kent E. Holsinger,10.1007/s11222-006-9015-6,,https://doi.org/10.1007/s11222-006-9015-6,crossref,latent dynamics model robotics,concept,architecture,,4,latent dynamics model robotics,2026-06-12T15:07:36Z,12.405,12.405
doi:10.1097/wnr.0000000000000131,Brain activity and the perception of self-agency while viewing a video of tool manipulation,,2014,NeuroReport,Satoshi Wakata; Shu Morioka,10.1097/wnr.0000000000000131,,https://doi.org/10.1097/wnr.0000000000000131,crossref,Gaussian splatting robot perception bimanual manipulation,concept,architecture_x_embodiment,,4,Gaussian splatting robot perception; bimanual manipulation,2026-06-12T15:07:36Z,12.405,12.405
doi:10.1109/icra.2011.5980159,Electrode displacement patterns inferred as the optimal control criteria during the resistance spot welding process,,2011,2011 IEEE International Conference on Robotics and Automation,Liang Gong; Cheng-liang Liu,10.1109/icra.2011.5980159,,https://doi.org/10.1109/icra.2011.5980159,crossref,robotics,concept,crossref_bulk_robotics,,4,,2026-06-12T19:29:26Z,12.405,13.405
doi:10.1016/j.rcim.2023.102624,ACWGAN-GP for milling tool breakage monitoring with imbalanced data,,2024,Robotics and Computer-Integrated Manufacturing,Xuebing Li; Caixu Yue; Xianli Liu; Jiaqi Zhou; Lihui Wang,10.1016/j.rcim.2023.102624,,https://doi.org/10.1016/j.rcim.2023.102624,crossref,EBM transformer robotics tool use robotics,concept,architecture_x_embodiment,,54,EBM transformer robotics; tool use robotics,2026-06-12T15:07:36Z,12.404,12.404
doi:10.1364/oe.420972,Real-time multi-functional near-infrared wave manipulation with a 3-bit liquid crystal based coding metasurface,"We propose a new generation of reprogrammable multi-functional bias encoded metasurfaces for dynamic wave manipulation using liquid crystals (LC). This metadevice is an array of unit-cells based on LCs to provide the desired phase steps based on its large birefringence property. The presented 3-bit coding metasurface (CM) use 8 states of ""000""-""111"" to control and manipulate the scattered wave at λ =1.4 µ m for several applications. The metasurface is introduced in detail and followed by several examples to show its versatility. Steered pencil, regular, and focused vortex beams with different topological charges are realized. The theoretical predictions are confirmed by numerical simulations. The proposed CM enables the realization of multifunctional optical wavefront manipulation and future intelligent optical devices.",2021,Optics Express,Javad Shabanpour; Morteza Sedaghat; Vahid Nayyeri; Homayoon Oraizi; Omar M. Ramahi,10.1364/oe.420972,,https://doi.org/10.1364/oe.420972,crossref,sim to real robot manipulation,concept,sim2real,,44,robot manipulation,2026-06-12T15:07:36Z,12.403,13.403
doi:10.1109/tii.2018.2882741,Prediction of Human Activity Patterns for Human–Robot Collaborative Assembly Tasks,"It is widely agreed that future manufacturing environments will be populated by humans and robots sharing the same workspace. However, the real collaboration can be sporadic, especially in the case of assembly tasks, which might involve autonomous operations to be executed by either the robot or the human worker. In this scenario, it might be beneficial to predict the actions of the human in order to control the robot both safely and efficiently. In this paper, we propose a method to predict human activity patterns in order to early infer when a specific collaborative operation will be requested by the human and to allow the robot to perform alternative autonomous tasks in the meanwhile. The prediction algorithm is based on higher-order Markov chains and is experimentally verified in a realistic scenario involving a dual-arm robot employed in a small part collaborative assembly task.",2018,IEEE Transactions on Industrial Informatics,Andrea Maria Zanchettin; Andrea Casalino; Luigi Piroddi; Paolo Rocco,10.1109/tii.2018.2882741,,https://doi.org/10.1109/tii.2018.2882741,openalex,robotics,concept,openalex_bulk_robotics,,134,,2026-06-12T18:57:17Z,12.403,12.403
doi:10.1007/978-3-319-78963-7_26,On the Use of Inner Position Loop in Co-manipulation Task,,2019,"CISM International Centre for Mechanical Sciences ROMANSY 22 – Robot Design, Dynamics and Control",Sylvain Devie; Pierre-Philippe Robet; Yannick Aoustin; Maxime Gautier,10.1007/978-3-319-78963-7_26,,https://doi.org/10.1007/978-3-319-78963-7_26,crossref,robot world models manipulation,concept,world_models,,,robot world model,2026-06-12T15:07:36Z,12.400,12.400
doi:10.1299/jsmermd.2019.2p1-g08,Generating regrasp motion toward grasping for tool manipulation automatically by a parallel gripper of single/dual-arm robot,,2019,The Proceedings of JSME annual Conference on Robotics and Mechatronics (Robomec),Takayuki MUROOKA; Kei OKADA; Masayuki INABA,10.1299/jsmermd.2019.2p1-g08,,https://doi.org/10.1299/jsmermd.2019.2p1-g08,crossref,robot world models manipulation,concept,world_models,,,robot world model,2026-06-12T15:07:36Z,12.400,12.400
doi:10.5954/icarob.2019.gs2-5,The Use of Importance Ranks to Derive Suitable Timing of Visual Sensing in Manipulation Task Containing Error Recovery,,2019,Proceedings of International Conference on Artificial Life and Robotics,Akira Nakamura; Kazuyuki Nagata; Kensuke Harada; Yukiyasu Domae,10.5954/icarob.2019.gs2-5,,https://doi.org/10.5954/icarob.2019.gs2-5,crossref,physical reasoning robotics manipulation,concept,physical_reasoning,,,,2026-06-12T15:07:36Z,12.400,12.400
doi:10.1109/carpathiancc.2019.8766032,Web tool for creating 3D visualizations with focus on real-time direct manipulation of mathematical objects' attributes,,2019,2019 20th International Carpathian Control Conference (ICCC),Jana Pocsova; Michal Takac; Andrea Mojzisova,10.1109/carpathiancc.2019.8766032,,https://doi.org/10.1109/carpathiancc.2019.8766032,crossref,sim to real robot manipulation,concept,sim2real,,,robot manipulation,2026-06-12T15:07:36Z,12.400,13.400
doi:10.4324/9781315808055-16,Patterns of Object Manipulation,,2019,Cognitive Structure and Development in Nonhuman Primates,Francesco Natale,10.4324/9781315808055-16,,https://doi.org/10.4324/9781315808055-16,crossref,deformable object manipulation robot learning,concept,deformable,,,deformable object manipulation,2026-06-12T15:07:36Z,12.400,12.400
doi:10.1007/978-3-030-12512-7_7,Possibilities of the Use of the Technology and System of Noise Control of the Beginning of the Latent Period of Accidents on Technical Facilities,,2019,Noise Control of the Beginning and Development Dynamics of Accidents,Telman Aliev,10.1007/978-3-030-12512-7_7,,https://doi.org/10.1007/978-3-030-12512-7_7,crossref,latent dynamics model robot control,concept,latent_dynamics,,,,2026-06-12T15:07:36Z,12.400,12.400
doi:10.21956/mep.19058.r27413,Peer Review Report For: Perception and acceptance of senior medical students at King Abdulaziz University of the use of Objective Structured Clinical Examination as a tool of assessment [version 1],,2019,,,10.21956/mep.19058.r27413,,https://doi.org/10.21956/mep.19058.r27413,crossref,Gaussian splatting robot perception tool use robotics,concept,architecture_x_embodiment,,,Gaussian splatting robot perception; tool use robotics,2026-06-12T15:07:36Z,12.400,12.400
doi:10.1145/3606261,Scarecrows in Oz: The Use of Large Language Models in HRI,"The proliferation of Large Language Models (LLMs) presents both a critical design challenge and a remarkable opportunity for the field of Human–Robot Interaction (HRI). While the direct deployment of LLMs on interactive robots may be unsuitable for reasons of ethics, safety, and control, LLMs might nevertheless provide a promising baseline technique for many elements of HRI. Specifically, in this article, we argue for the use of LLMs as Scarecrows : “brainless,” straw-man black-box modules integrated into robot architectures for the purpose of quickly enabling full-pipeline solutions, much like the use of “Wizard of Oz” (WoZ) and other human-in-the-loop approaches. We explicitly acknowledge that these Scarecrows, rather than providing a satisfying or scientifically complete solution, incorporate a form of the wisdom of the crowd and, in at least some cases, will ultimately need to be rep",2024,ACM Transactions on Human-Robot Interaction,Tom Williams; Cynthia Matuszek; Ross Mead; Nick Depalma,10.1145/3606261,,https://doi.org/10.1145/3606261,crossref,robot world models manipulation,concept,world_models,,26,robot world model; human robot interaction; deployment,2026-06-12T15:07:36Z,12.398,13.398
doi:10.1038/s41467-023-39983-4,A general model-based causal inference method overcomes the curse of synchrony and indirect effect,"Abstract To identify causation, model-free inference methods, such as Granger Causality, have been widely used due to their flexibility. However, they have difficulty distinguishing synchrony and indirect effects from direct causation, leading to false predictions. To overcome this, model-based inference methods that test the reproducibility of data with a specific mechanistic model to infer causality were developed. However, they can only be applied to systems described by a specific model, greatly limiting their applicability. Here, we address this limitation by deriving an easily testable condition for a general monotonic ODE model to reproduce time-series data. We built a user-friendly computational package, General ODE-Based Inference (GOBI), which is applicable to nearly any monotonic system with positive and negative regulations described by ODE. GOBI successfully inferred positiv",2023,Nature Communications,Se Ho Park; Seokmin Ha; Jae Kyoung Kim,10.1038/s41467-023-39983-4,,https://doi.org/10.1038/s41467-023-39983-4,crossref,causal robot world model,concept,architecture,,19,robot world model; causal robot world model; limitation; reproducibility,2026-06-12T15:07:36Z,12.398,15.398
doi:10.1007/s11336-019-09693-2,A Sparse Latent Class Model for Cognitive Diagnosis,"Cognitive diagnostic models (CDMs) are latent variable models developed to infer latent skills, knowledge, or personalities that underlie responses to educational, psychological, and social science tests and measures. Recent research focused on theory and methods for using sparse latent class models (SLCMs) in an exploratory fashion to infer the latent processes and structure underlying responses. We report new theoretical results about sufficient conditions for generic identifiability of SLCM parameters. An important contribution for practice is that our new generic identifiability conditions are more likely to be satisfied in empirical applications than existing conditions that ensure strict identifiability. Learning the underlying latent structure can be formulated as a variable selection problem. We develop a new Bayesian variable selection algorithm that explicitly enforces generic ",2020,Psychometrika,Yinyin Chen; Steven Culpepper; Feng Liang,10.1007/s11336-019-09693-2,,https://doi.org/10.1007/s11336-019-09693-2,crossref,latent dynamics model robotics,concept,architecture,,65,latent dynamics model robotics,2026-06-12T15:07:36Z,12.395,12.395
doi:10.3390/s24082551,Learning-Based Control of Autonomous Vehicles Using an Adaptive Neuro-Fuzzy Inference System and the Linear Matrix Inequality Approach,"This paper proposes a learning-based control approach for autonomous vehicles. An explicit Takagi-Sugeno (TS) controller is learned using input and output data from a preexisting controller, employing the Adaptive Neuro-Fuzzy Inference System (ANFIS) algorithm. At the same time, the vehicle model is identified in the TS model form for closed-loop stability assessment using Lyapunov theory and LMIs. The proposed approach is applied to learn the control law from an MPC controller, thus avoiding the use of online optimization. This reduces the computational burden of the control loop and facilitates real-time implementation. Finally, the proposed approach is assessed through simulation using a small-scale autonomous racing car.",2024,Sensors,Mohammad Sheikhsamad; Vicenç Puig,10.3390/s24082551,,https://doi.org/10.3390/s24082551,openalex,energy based model robot learning,concept,ebm,,11,,2026-06-12T18:26:24Z,12.392,12.392
doi:10.1098/rsif.2024.0376,Weak-form inference for hybrid dynamical systems in ecology,"Species subject to predation and environmental threats commonly exhibit variable periods of population boom and bust over long timescales. Understanding and predicting such behaviour, especially given the inherent heterogeneity and stochasticity of exogenous driving factors over short timescales, is an ongoing challenge. A modelling paradigm gaining popularity in the ecological sciences for such multi-scale effects is to couple short-term continuous dynamics to long-term discrete updates. We develop a data-driven method utilizing weak-form equation learning to extract such hybrid governing equations for population dynamics and to estimate the requisite parameters using sparse intermittent measurements of the discrete and continuous variables. The method produces a set of short-term continuous dynamical system equations parametrized by long-term variables, and long-term discrete equations",2024,Journal of The Royal Society Interface,Daniel Messenger; Greg Dwyer; Vanja Dukic,10.1098/rsif.2024.0376,,https://doi.org/10.1098/rsif.2024.0376,crossref,hybrid dynamical systems robotics,anti_myopia,anti_thesis,,7,hybrid dynamical systems robotics,2026-06-12T15:07:36Z,12.390,15.390
doi:10.1109/lra.2020.2969941,Vision-Based Dynamic Virtual Fixtures for Tools Collision Avoidance in Robotic Surgery,"In robot-aided surgery, during the execution of typical bimanual procedures such as dissection, surgical tools can collide and create serious damage to the robot or tissues. The da Vinci robot is one of the most advanced and certainly the most widespread robotic system dedicated to minimally invasive surgery. Although the procedures performed by da Vinci-like surgical robots are teleoperated, potential collisions between surgical tools are a very sensitive issue declared by surgeons. Shared control techniques based on Virtual Fixtures (VF) can be an effective way to help the surgeon prevent tools collision. This letter presents a surgical tools collision avoidance method that uses Forbidden Region Virtual Fixtures. Tool clashing is avoided by rendering a repulsive force to the surgeon. To ensure the correct definition of the VF, a marker-less tool tracking method, using deep neural netwo",2020,IEEE Robotics and Automation Letters,Rocco Moccia; Cristina Iacono; Bruno Siciliano; Fanny Ficuciello,10.1109/lra.2020.2969941,,https://doi.org/10.1109/lra.2020.2969941,openalex,robotics,concept,openalex_bulk_robotics,,58,surgical robot; occlusion,2026-06-12T18:57:17Z,12.389,12.389
doi:10.1155/2022/2585656,"Autonomous Robotic Manipulation: Real-Time, Deep-Learning Approach for Grasping of Unknown Objects","Recent advancement in vision-based robotics and deep-learning techniques has enabled the use of intelligent systems in a wider range of applications requiring object manipulation. Finding a robust solution for object grasping and autonomous manipulation became the focus of many engineers and is still one of the most demanding problems in modern robotics. This paper presents a full grasping pipeline proposing a real-time data-driven deep-learning approach for robotic grasping of unknown objects using MATLAB and convolutional neural networks. The proposed approach employs RGB-D image data acquired from an eye-in-hand camera centering the object of interest in the field of view using visual servoing. Our approach aims at reducing propagation errors and eliminating the need for complex hand tracking algorithm, image segmentation, or 3D reconstruction. The proposed approach is able to efficie",2022,Journal of Robotics,Malak H. Sayour; Sharbel E. Kozhaya; Samer S. Saab,10.1155/2022/2585656,,https://doi.org/10.1155/2022/2585656,crossref,contact rich manipulation learning,concept,contact,,28,contact rich manipulation; visual servoing,2026-06-12T15:07:36Z,12.384,12.384
doi:10.1002/smll.202107795,Deep Learning‐Assisted Automated Single Cell Electroporation Platform for Effective Genetic Manipulation of Hard‐to‐Transfect Cells,"Abstract Genome engineering of cells using CRISPR/Cas systems has opened new avenues for pharmacological screening and investigating the molecular mechanisms of disease. A critical step in many such studies is the intracellular delivery of the gene editing machinery and the subsequent manipulation of cells. However, these workflows often involve processes such as bulk electroporation for intracellular delivery and fluorescence activated cell sorting for cell isolation that can be harsh to sensitive cell types such as human‐induced pluripotent stem cells (hiPSCs). This often leads to poor viability and low overall efficacy, requiring the use of large starting samples. In this work, a fully automated version of the nanofountain probe electroporation (NFP‐E) system, a nanopipette‐based single‐cell electroporation method is presented that provides superior cell viability and efficiency compa",2022,Small,Prithvijit Mukherjee; Cesar A. Patino; Nibir Pathak; Vincent Lemaitre; Horacio D. Espinosa,10.1002/smll.202107795,,https://doi.org/10.1002/smll.202107795,crossref,contact rich manipulation learning,concept,contact,,28,contact rich manipulation,2026-06-12T15:07:36Z,12.384,12.384
doi:10.1146/annurev-control-060117-105206,Internal Models in Biological Control,"Rationality principles such as optimal feedback control and Bayesian inference underpin a probabilistic framework that has accounted for a range of empirical phenomena in biological sensorimotor control. To facilitate the optimization of flexible and robust behaviors consistent with these theories, the ability to construct internal models of the motor system and environmental dynamics can be crucial. In the context of this theoretic formalism, we review the computational roles played by such internal models and the neural and behavioral evidence for their implementation in the brain.",2019,"Annual Review of Control, Robotics, and Autonomous Systems",Daniel McNamee; Daniel M. Wolpert,10.1146/annurev-control-060117-105206,,https://doi.org/10.1146/annurev-control-060117-105206,crossref,hybrid systems robot control manipulation,anti_myopia,control,,213,hybrid systems,2026-06-12T15:07:36Z,12.383,15.383
doi:10.1001/jamanetworkopen.2021.2265,Comparison of 1-Year Health Care Costs and Use Associated With Open vs Robotic-Assisted Radical Prostatectomy,"Importance: With the current patterns of adoption and use of robotic surgery and improvement in the overall survival of patients with prostate cancer, it is important to evaluate the immediate and long-term cost implications of treatments for patients with prostate cancer. Objective: To compare health care costs and use 1 year after open radical prostatectomy (ORP) vs robotic-assisted radical prostatectomy (RARP). Design, Setting, and Participants: This retrospective cohort study used a US commercial claims database from January 1, 2013, to December 31, 2018. A total of 11 457 men aged 18 to 64 years who underwent inpatient radical prostatectomy for prostate cancer and were continuously enrolled with medical and prescription drug coverage from 180 days before to 365 days after inpatient prostatectomy were identified. An inverse probability of treatment weighting analysis was performed to",2021,JAMA Network Open,Kennedy E. Okhawere; I‐Fan Shih; Shih-Hao Lee; Yanli Li; Jaime A. Wong; Ketan K. Badani,10.1001/jamanetworkopen.2021.2265,,https://doi.org/10.1001/jamanetworkopen.2021.2265,openalex,robotics,concept,openalex_bulk_robotics,,38,,2026-06-12T18:57:17Z,12.382,12.382
doi:10.1109/tmech.2020.2967748,Design and Kinematics Analysis of a Robotic Pediatric Neuroendoscope Tool Body,"Endoscopy is often used to treat hydrocephalus, a common pediatric neurosurgical condition. Rigid endoscopic tools used in these procedures have many limitations. In this article, we propose four novel designs for a steerable two degree-of-freedom robotic tool body to be deployed through a rigid endoscope and a handheld controller for such a tool body. Each of these designs make use of tendon-driven joints known as asymmetric notch joints, while varying tendon routing techniques. Furthermore, we design a compact handheld controller for this steerable tool body, which consists of dc motors driving lead screws to actuate the tendons for each of the robot's joints. A disturbance observer-based control system for these motors is designed to allow the motor to reach the desired tendon displacements under various loading conditions. Next, we analyze the kinematics of the bidirectional asymmetr",2020,IEEE/ASME Transactions on Mechatronics,Yash Chitalia; Seokhwan Jeong; Nancy J. Deaton; Joshua J. Chern; Jaydev P. Desai,10.1109/tmech.2020.2967748,,https://doi.org/10.1109/tmech.2020.2967748,openalex,robotics,concept,openalex_bulk_robotics,,57,limitation,2026-06-12T18:57:17Z,12.380,13.380
doi:10.1145/3508396.3512877,Towards battery-free machine learning and inference in underwater environments,"This paper is motivated by a simple question: Can we design and build battery-free devices capable of machine learning and inference in underwater environments? An affirmative answer to this question would have significant implications for a new generation of underwater sensing and monitoring applications for environmental monitoring, scientific exploration, and climate/weather prediction.",2022,,Yuchen Zhao; Sayed Saad Afzal; Waleed Akbar; Osvy Rodriguez; Fan Mo; David Boyle; Fadel Adib; Hamed Haddadi,10.1145/3508396.3512877,,https://doi.org/10.1145/3508396.3512877,openalex,energy based model robot learning,concept,ebm,,25,,2026-06-12T18:26:24Z,12.379,12.379
