uid,title,abstract,year,venue,authors,doi,arxiv_id,url,source,query,query_role,family,advisor_seed,citation_count,matched_terms,retrieved_at,relevance_score,hostile_score
doi:10.1109/humanoids.2015.7363586,Teaching robots the use of human tools from demonstration with non-dexterous end-effectors,"Commercial, affordable and general-purpose robots like the PR-2, Baxter and UBR-1 robots can take over a wide range of tasks or assist human workers in a mixed human-robot environment. However, end-effectors on these robots are usually restricted to low-cost, non-dexterous grippers which constrains the application scenarios. We aim at increasing their range by teaching such robots the use of human tools by demonstration. We present a novel and compact model for the use of human tools and propose a dual-gripper strategy in replacement of the much less widely deployed dexterous hand for tool manipulation. Especially, we propose a hierarchical architecture to embed tool use in a learning from demonstration framework, learning temporal order for dual-arm coordination at higher level and Dynamic Movement Primitives at lower level for a multi-step execution. The approach is demonstrated and ev",2015,,Wenbin Li; Mario Fritz,10.1109/humanoids.2015.7363586,,https://doi.org/10.1109/humanoids.2015.7363586,openalex,robotics,concept,openalex_bulk_robotics,,18,,2026-06-12T18:57:17Z,13.172,13.172
doi:10.1007/s10015-013-0105-1,Bayesian learning of tool affordances based on generalization of functional feature to estimate effects of unseen tools,,2013,Artificial Life and Robotics,Raghvendra Jain; Tetsunari Inamura,10.1007/s10015-013-0105-1,,https://doi.org/10.1007/s10015-013-0105-1,crossref,score based policy robotics,concept,diffusion,,22,generalization,2026-06-12T15:07:36Z,13.168,14.168
arxiv:2603.05410v1,PhysiFlow: Physics-Aware Humanoid Whole-Body VLA via Multi-Brain Latent Flow Matching and Robust Tracking,"In the domain of humanoid robot control, the fusion of Vision-Language-Action (VLA) with whole-body control is essential for semantically guided execution of real-world tasks. However, existing methods encounter challenges in terms of low VLA inference efficiency or an absence of effective semantic guidance for whole-body control, resulting in instability in dynamic limb-coordinated tasks. To bridge this gap, we present a semantic-motion intent guided, physics-aware multi-brain VLA framework for humanoid whole-body control. A series of experiments was conducted to evaluate the performance of the proposed framework. The experimental results demonstrated that the framework enabled reliable vision-language-guided full-body coordination for humanoid robots.",2026,arXiv,Weikai Qin; Sichen Wu; Ci Chen; Mengfan Liu; Linxi Feng; Xinru Cui; Haoqi Han; Hesheng Wang,,2603.05410v1,http://arxiv.org/abs/2603.05410v1,arxiv,whole body manipulation humanoid,concept,humanoid,,,humanoid robot,2026-06-12T14:45:03Z,13.150,14.150
doi:10.1007/978-3-030-36150-1_54,A Modelling and Formalisation Tool for Use Case Design in Social Autonomous Robotics,,2020,Advances in Intelligent Systems and Computing Robot 2019: Fourth Iberian Robotics Conference,Alba Gragera; Alba María García; Fernando Fernández,10.1007/978-3-030-36150-1_54,,https://doi.org/10.1007/978-3-030-36150-1_54,crossref,EBM transformer robotics tool use robotics,concept,architecture_x_embodiment,,2,EBM transformer robotics; tool use robotics,2026-06-12T15:07:36Z,13.149,13.149
doi:10.1016/j.jala.2011.03.003,Automated Transportation of Single Cells Using Robot-Tweezer Manipulation System,"Manipulation of biological cells becomes increasingly important in biomedical engineering to address challenge issues in cell—cell interaction, drug discovery, and tissue engineering. Significant demand for both accuracy and productivity in cell manipulation highlights the need for automated cell transportation with integrated robotics and micro/nano manipulation technologies. Optical tweezers, which use highly focused low-power laser beams to trap and manipulate particles at micro/nanoscale, have emerged as an essential tool for manipulating single cells. In this article, we propose to use a robot-tweezer manipulation system to solve the problem of automatic transportation of biological cells, where optical tweezers function as special robot end effectors. Dynamics equation of the cell in optical tweezers is analyzed. A closed-loop controller is designed for transporting and positioning",2011,JALA: Journal of the Association for Laboratory Automation,Songyu Hu; Dong Sun,10.1016/j.jala.2011.03.003,,https://doi.org/10.1016/j.jala.2011.03.003,crossref,robot world models manipulation,concept,world_models,,19,robot world model,2026-06-12T15:07:36Z,13.148,13.148
doi:10.1109/transducers50396.2021.9495627,Reconfigurable Acoustofluidic Manipulation of Particles in Ring-Like Rich Patterns Enabled on a Bulk Micromachined Silicon Chip,,2021,"2021 21st International Conference on Solid-State Sensors, Actuators and Microsystems (Transducers)",Jingui Qian; Renhua Yang; Habiba Begum; Joshua E-Y. Lee,10.1109/transducers50396.2021.9495627,,https://doi.org/10.1109/transducers50396.2021.9495627,crossref,contact rich manipulation learning,concept,contact,,1,contact rich manipulation,2026-06-12T15:07:36Z,13.147,13.147
doi:10.21125/iceri.2021.0530,SERIOUS GAMES: A TOOL WE CAN USE AS REAL WORLD SIMULATOR. “CITIES SKYLINES” IN THE LEARNING OF THE LAW ON EXPENDITURES,,2021,ICERI Proceedings ICERI2021 Proceedings,Irune Suberbiola Garbizu,10.21125/iceri.2021.0530,,https://doi.org/10.21125/iceri.2021.0530,crossref,real world robot learning deployment,concept,deployment,,1,deployment,2026-06-12T15:07:36Z,13.147,15.147
doi:10.1111/aepr.12326,Comment on “ Energy‐Related Environmental Policy and Its Impacts on Energy Use in Asia”,,2021,Asian Economic Policy Review,Nobuo Tanaka,10.1111/aepr.12326,,https://doi.org/10.1111/aepr.12326,crossref,energy based policy robotics,concept,ebm,,1,,2026-06-12T17:50:07Z,13.147,13.147
doi:10.1184/r1/6720200,Inference Machines: Parsing Scenes via Iterated Predictions,"Extracting a rich representation of an environment from visual sensor readings can benefit many tasks in robotics, e.g., path planning, mapping, and object manipulation. While important progress has been made, it remains a difficult problem to effectively parse entire scenes, i.e., to recognize semantic objects, man-made structures, and landforms. This process requires not only recognizing individual entities but also understanding the contextual relations among them. The prevalent approach to encode such relationships is to use a joint probabilistic or energy-based model which enables one to naturally write down these interactions. Unfortunately, performing exact inference over these expressive models is often intractable and instead we can only approximate the solutions. While there exists a set of sophisticated approximate inference techniques to choose from, the combination of learni",2013,Research Showcase @ Carnegie Mellon University (Carnegie Mellon University),"Munoz, Daniel",10.1184/r1/6720200,,https://doi.org/10.1184/r1/6720200,openalex,energy based model robot learning,concept,ebm,,17,,2026-06-12T18:26:24Z,13.145,13.145
doi:10.1002/ece3.11400,Temperature and soil moisture manipulation yields evidence of drought‐induced pollen limitation in bee‐pollinated squash,"Abstract Climate change alters environmental conditions in ways that directly and indirectly affect plants. Flowering plants, for example, modify reproductive allocation in response to heat and drought stress, and such changes can in turn affect pollinator visitation and, ultimately, plant reproduction. Although the individual effects of warming and drought on plant reproductive allocation are well known, these factors may interact to influence reproduction. Here, we conducted a fully crossed temperature by irrigation manipulation in squash ( Cucurbita pepo ) to test how temperature and soil moisture variation affect pollinator‐mediated reproduction. To tease apart the direct and indirect effects of temperature and soil moisture, we compared hand‐pollinated plants to bee‐pollinated plants and restricted bee foraging (i.e., pollen transfer) to one experimental group per day. Temperature a",2024,Ecology and Evolution,Jess Gambel; David A. Holway,10.1002/ece3.11400,,https://doi.org/10.1002/ece3.11400,crossref,diffusion policy limitation robot manipulation,hostile,failure,,7,diffusion policy; robot manipulation; limitation; diffusion policy limitation,2026-06-12T15:07:36Z,13.140,18.140
doi:10.3390/drones3020040,A Review on the Use of Unmanned Aerial Vehicles and Imaging Sensors for Monitoring and Assessing Plant Stresses,"Unmanned aerial vehicles (UAVs) are becoming a valuable tool to collect data in a variety of contexts. Their use in agriculture is particularly suitable, as those areas are often vast, making ground scouting difficult, and sparsely populated, which means that injury and privacy risks are not as important as in urban settings. Indeed, the use of UAVs for monitoring and assessing crops, orchards, and forests has been growing steadily during the last decade, especially for the management of stresses such as water, diseases, nutrition deficiencies, and pests. This article presents a critical overview of the main advancements on the subject, focusing on the strategies that have been used to extract the information contained in the images captured during the flights. Based on the information found in more than 100 published articles and on our own research, a discussion is provided regarding t",2019,Drones,Jayme Garcia Arnal Barbedo,10.3390/drones3020040,,https://doi.org/10.3390/drones3020040,openalex,energy based policy robotics,concept,ebm,,385,,2026-06-12T18:43:24Z,13.128,13.128
doi:10.1101/2020.09.01.277095,VeTra: a tool for trajectory inference based on RNA velocity,"ABSTRACT Trajectory inference (TI) for single cell RNA sequencing (scRNAseq) data is a powerful approach to interpret dynamic cellular processes such as cell cycle and development. Still, however, accurate inference of trajectory is challenging. Recent development of RNA velocity provides an approach to visualize cell state transition without relying on prior knowledge. To perform TI and group cells based on RNA velocity we developed VeTra. By applying cosine similarity and merging weakly connected components, VeTra identifies cell groups from the direction of cell transition. Besides, VeTra suggests key regulators from the inferred trajectory. VeTra is a useful tool for TI and subsequent analysis.",,,Guangzheng Weng; Junil Kim; Kyoung Jae Won,10.1101/2020.09.01.277095,,https://doi.org/10.1101/2020.09.01.277095,crossref,trajectory transformer,concept,architecture,,4,trajectory transformer,2026-06-12T15:07:36Z,13.105,13.105
doi:10.1002/widm.1507,A systematic review of Green AI,"Abstract With the ever‐growing adoption of artificial intelligence (AI)‐based systems, the carbon footprint of AI is no longer negligible. AI researchers and practitioners are therefore urged to hold themselves accountable for the carbon emissions of the AI models they design and use. This led in recent years to the appearance of researches tackling AI environmental sustainability, a field referred to as Green AI. Despite the rapid growth of interest in the topic, a comprehensive overview of Green AI research is to date still missing. To address this gap, in this article, we present a systematic review of the Green AI literature. From the analysis of 98 primary studies, different patterns emerge. The topic experienced a considerable growth from 2020 onward. Most studies consider monitoring AI model footprint, tuning hyperparameters to improve model sustainability, or benchmarking models.",2023,Wiley Interdisciplinary Reviews Data Mining and Knowledge Discovery,Roberto Verdecchia; June Sallou; Luís Cruz,10.1002/widm.1507,,https://doi.org/10.1002/widm.1507,openalex,energy based policy robotics,concept,ebm,,270,benchmark,2026-06-12T18:05:07Z,13.101,14.101
doi:10.1109/icar.2017.8023497,Reconfigurable fixture evaluation for use in automotive light assembly,,2017,2017 18th International Conference on Advanced Robotics (ICAR),Martin Bem; Miha Denisa; Timotej Gaspar; Jaka Jereb; Robert Bevec; Igor Kovac; Ales Ude,10.1109/icar.2017.8023497,,https://doi.org/10.1109/icar.2017.8023497,crossref,robotics,concept,crossref_bulk_robotics,,8,,2026-06-12T19:29:26Z,13.099,14.099
doi:10.1007/s11077-024-09540-x,Consultancy firms’ roles in policy diffusion: a systematic review from the environmental governance field,"Abstract Since the 1980’s, the growing involvement of private consultancy firms in the public sector worldwide has instigated concerns about the outsourcing of public policy advising to market-driven actors. Although these firms participate in spreading policy ideas, their roles have not received sustained attention, despite being observed by a few scholars. Against this background, the aim of this paper is threefold. First, from established policy concepts relating to policy diffusion, we identify the potential roles that consultancy firms may take on in spreading policy ideas. Second, we use a systematic literature review to collect and distil what is currently known about what different roles consultancy firms fulfil, and what kinds of tensions arise in their interactions with both clients and other actors. Third, we draft an agenda for future research on consultancy firms’ impact in ",2024,Policy Sciences,Alejandra Burchard-Levine; Dave Huitema; Nicolas W. Jager; Iris Bijlsma,10.1007/s11077-024-09540-x,,https://doi.org/10.1007/s11077-024-09540-x,crossref,diffusion policy robot manipulation,concept,diffusion,,1,diffusion policy; robot manipulation,2026-06-12T15:07:36Z,13.097,13.097
doi:10.1134/s023408791906008x,Использование структурных мутаций в объектно-ориентированных математических моделях манипуляционных систем роботов Use of structural mutations in object-oriented mathematical models of robot manipulation systems,"Рассмотрено использование метода целенаправленных структурных мутаций математических моделей. Метод позволяет создавать приближeнные модели манипуляционных систем роботов путeм модификации их объектно-ориентированных математических моделей. Манипуляционные системы рассматриваются как непрерывно-детерминированные системы, описываемые системами алгебраических и обыкновенных дифференциальных уравнений. Реализация данного метода основывается на возможностях предоставляемых методом визуального конструирования объектных схем математических моделей. Модификации объектных схем проводятся путeм замены выбранных в них частей на альтернативные этим частям объекты. Применение метода структурных мутаций позволяет компенсировать влияние случайных факторов, не учитываемых исходной математической моделью, полученной аналитическим способом.",2019,Математическое моделирование Matematicheskoe modelirovanie,Олег Николаевич Крахмалев; Oleg Nikolaevich Krakhmalev,10.1134/s023408791906008x,,https://doi.org/10.1134/s023408791906008x,crossref,robot world models manipulation,concept,world_models,,3,robot world model; robot manipulation,2026-06-12T14:45:03Z,13.093,13.093
doi:10.1371/journal.pone.0268777,State-of-the-art on analytic hierarchy process in the last 40 years: Literature review based on Latent Dirichlet Allocation topic modelling,"Although there are several articles that have carried out a systematic literature review of the analytical hierarchy process (AHP), many of them work with a limited number of analyzed documents. This article presents a computer-aided systematic literature review of articles related to AHP. The objectives are: (i) to identify AHP usage and research impact in different subject areas; (ii) to identify trends in the popularity of the AHP from the first introduction of the method in 1980 to the present; (iii) to identify the most common topics related to AHP and topic development over time. We process 35,430 documents related to AHP, published between 1980 and 2021, retrieved from the Scopus database. We provide detailed statistics about research interest, research impact in particular subject areas over the analyzed time period. We use Latent Dirichlet Allocation (LDA) using Gibbs sampling t",2022,PLoS ONE,Peter Madzík; Lukáš Falát,10.1371/journal.pone.0268777,,https://doi.org/10.1371/journal.pone.0268777,openalex,energy based model robot learning,concept,ebm,,106,,2026-06-12T18:05:07Z,13.086,13.086
doi:10.1109/robot.2009.5152574,Statistically integrated semiotics that enables mutual inference between linguistic and behavioral symbols for humanoid robots,This paper describes the linguistic model based on symbolization of motion patterns for humanoid robots. The model consists of two kinds of stochastic models : the motion language model and the natural language model. The motion language model stochastically connects the symbols of motion patterns to the morpheme words through the latent states which represent the underlying linguistic structure such as semantic contents. The natural language model represents the dynamics of the word classes. The motion language model and the natural language model correspond to semantics and syntax respectively. The integration of the motion language model and the natural language model allows robots not only to linguistically interpret the motion patterns as sentences but also to generate the motions from the sentences. The two kinds of linguistic processes of the interpretation and the generation can ,2009,,Wataru Takano; Yoshihiko Nakamura,10.1109/robot.2009.5152574,,https://doi.org/10.1109/robot.2009.5152574,openalex,robotics,concept,openalex_bulk_robotics,,31,humanoid robot,2026-06-12T18:57:17Z,13.083,13.083
doi:10.3389/fsci.2024.1411259,"Vertical farming goes dynamic: optimizing resource use efficiency, product quality, and energy costs","Vertical farming is considered to be a key enabler for transforming agrifood systems, especially in or nearby urbanized areas. Vertical farming systems (VFS) are advanced indoor cropping systems that allow for highly intensified and standardized plant production. The close control of environmental parameters makes crop production stable and repeatable, ensuring year-round uniform product quality and quantity irrespective of location. However, due to continuous changes in plant physiology and development, as well as frequent changes in electricity prices, the optimum conditions for crop production and its associated costs can change within days or even minutes. This makes it beneficial to dynamically adjust setpoints for light (intensity, spectrum, pattern, and daylength), CO 2 , temperature, humidity, air flow, and water and nutrient availability. In this review, we highlight the benefic",2024,Frontiers in Science,Elias Kaiser; Paul Kusuma; Silvère Vialet‐Chabrand; Kevin M. Folta; Ying Liu; Hendrik Poorter; Nik Woning; Samikshya Shrestha; Aitor Ciarreta; Jordan van Brenk; Margarethe Karpe; Yongran Ji; Stephan David; Cristina Zepeda; Xin-Guang Zhu; Katharina Huntenburg; Julian C. Verdonk; Ernst J. Woltering; Paul P. G. Gauthier; Sarah Courbier,10.3389/fsci.2024.1411259,,https://doi.org/10.3389/fsci.2024.1411259,openalex,energy based model robot learning,concept,ebm,,95,,2026-06-12T18:05:07Z,13.082,13.082
doi:10.1016/s0301-4215(02)00004-6,Decision-making of nuclear energy policy: application of environmental management tool to nuclear fuel cycle,,2002,Energy Policy,Young Eal Lee; Kyoo-Kun Koh,10.1016/s0301-4215(02)00004-6,,https://doi.org/10.1016/s0301-4215(02)00004-6,crossref,energy based policy robotics,concept,ebm,,18,,2026-06-12T15:07:36Z,13.072,13.072
doi:10.1002/sdr.1478,Partial‐model testing as a validation tool for system dynamics (1983),"System dynamicists have long emphasized the use of multiple data sources and multiple methods to estimate parameters and test models. Ideally, one should estimate parameters using data "" below the level of aggregation of the model"" . For example, in a model of capital investment, one could estimate the length and order of the construction delay directly from data on the construction times for a large sample of relevant projects. Often, however, the needed data are not available. At the other end of the spectrum one can use "" whole model estimation"" in which the parameters are found by fitting the behavior of the full model to the available aggregate time series data. Whole model estimation, however, often suffers from identification problems. In this 1983 paper Jack Homer describes partial model testing, in which parameters are estimated within a subset of model structure rather than by ",2012,System Dynamics Review,Jack B. Homer,10.1002/sdr.1478,,https://doi.org/10.1002/sdr.1478,crossref,latent dynamics model robotics,concept,architecture,,68,latent dynamics model robotics,2026-06-12T15:07:36Z,13.067,13.067
doi:10.1109/rams.1996.500667,The use of fault trees for the design of robots for hazardous environments,"This paper addresses the application of fault trees to the analysis of robot manipulator reliability and fault tolerance. Although a common and useful tool in other applications, fault trees have only recently been applied to robots. In addition, most of the fault tree analyses in robotics have focused on qualitative, rather than quantitative, analysis. Robotic manipulators present some special problems, due to the complex and strongly coupled nature of their subsystems, and also their wild response to subsystem failures. Additionally, there is a lack of reliability data for robots and their subsystems. There has traditionally been little emphasis on fault tolerance in the design of industrial robots, and data regarding operational robot failures is relatively scarce. However, at this time there is a new and critical need for safe and reliable robots for remote environmental restoration ",2002,,Ian D. Walker; Joseph R. Cavallaro,10.1109/rams.1996.500667,,https://doi.org/10.1109/rams.1996.500667,openalex,robotics,concept,openalex_bulk_robotics,,30,industrial robot,2026-06-12T18:57:17Z,13.067,14.067
doi:10.1007/978-3-540-89859-7_17,iTASC: A Tool for Multi-Sensor Integration in Robot Manipulation,,2009,Lecture Notes in Electrical Engineering Multisensor Fusion and Integration for Intelligent Systems,Ruben Smits; Tinne De Laet; Kasper Claes; Herman Bruyninckx; Joris De Schutter,10.1007/978-3-540-89859-7_17,,https://doi.org/10.1007/978-3-540-89859-7_17,crossref,visuotactile robot manipulation,concept,tactile,,17,robot manipulation,2026-06-12T15:07:36Z,13.045,13.045
doi:10.1016/s0169-5150(01)00082-2,"Agent-based spatial models applied to agriculture: a simulation tool for technology diffusion, resource use changes and policy analysis",,2001,Agricultural Economics,T Berger,10.1016/s0169-5150(01)00082-2,,https://doi.org/10.1016/s0169-5150(01)00082-2,crossref,diffusion policy,concept,architecture,,17,diffusion policy,2026-06-12T15:07:36Z,13.045,13.045
doi:10.3390/su12010417,"A Tool to Analyze, Ideate and Develop Circular Innovation Ecosystems","The circular economy may help firms to maximize the value of their material resources and minimize the overall resource use, waste, pollution and emissions of their business activities. Implementing a circular economy program requires radical changes in product, business model and ecosystem innovation. Most research on circular oriented innovation takes a product or business model perspective. Few publications have explored how to innovate in ecosystems: how a group of loosely coupled organizations can change how they interact with each other to achieve a collective outcome. This study proposes the Circularity Deck: a card deck-based tool that can help firms to analyze, ideate and develop the circularity potential of their innovation ecosystems. The tool is based on a literature review of circular oriented innovation principles, and of practical examples that show how these principles ha",2020,Sustainability,Jan Konietzko; Nancy Bocken; Erik Jan Hultink,10.3390/su12010417,,https://doi.org/10.3390/su12010417,openalex,energy based model robot learning,concept,ebm,,216,,2026-06-12T18:26:24Z,13.040,13.040
