uid,title,abstract,year,venue,authors,doi,arxiv_id,url,source,query,query_role,family,advisor_seed,citation_count,matched_terms,retrieved_at,relevance_score,hostile_score
doi:10.1109/lra.2024.3427557,Hybrid-Driven Continuum Robot With Decoupled Motion Patterns for Dexterous Manipulation,,2024,IEEE Robotics and Automation Letters,Jinbo Hu; Jie Zhang; Yuquan Zheng; Bo Wang; Jianing Wu; Xiaojun Wang; Yunqiang Yang,10.1109/lra.2024.3427557,,https://doi.org/10.1109/lra.2024.3427557,crossref,robot world models manipulation,concept,world_models,,10,robot world model; dexterous manipulation,2026-06-12T15:07:36Z,14.599,14.599
doi:10.3389/frobt.2021.674292,Modeling and Learning Constraints for Creative Tool Use,"Improvisation is a hallmark of human creativity and serves a functional purpose in completing everyday tasks with novel resources. This is particularly exhibited in tool-using tasks: When the expected tool for a task is unavailable, humans often are able to replace the expected tool with an atypical one. As robots become more commonplace in human society, we will also expect them to become more skilled at using tools in order to accommodate unexpected variations of tool-using tasks. In order for robots to creatively adapt their use of tools to task variations in a manner similar to humans, they must identify tools that fulfill a set of task constraints that are essential to completing the task successfully yet are initially unknown to the robot. In this paper, we present a high-level process for tool improvisation (tool identification, evaluation, and adaptation), highlight the importanc",2021,Frontiers in Robotics and AI,Tesca Fitzgerald; Ashok Goel; Andrea Thomaz,10.3389/frobt.2021.674292,,https://doi.org/10.3389/frobt.2021.674292,crossref,differentiable physics robot learning,concept,architecture,,8,differentiable physics robot learning,2026-06-12T15:07:36Z,14.599,15.599
doi:10.1109/lra.2021.3074872,LaSeSOM: A Latent and Semantic Representation Framework for Soft Object Manipulation,,2021,IEEE Robotics and Automation Letters,Peng Zhou; Jihong Zhu; Shengzeng Huo; David Navarro-Alarcon,10.1109/lra.2021.3074872,,https://doi.org/10.1109/lra.2021.3074872,crossref,robot world models manipulation,concept,world_models,,35,robot world model,2026-06-12T15:07:36Z,14.592,14.592
doi:10.3390/w13162312,Machine Learning Modeling of Water Use Patterns in Small Disadvantaged Communities,"Water use patterns were explored for three small communities that are located in proximity to agricultural fields and rely on their local wells for potable water supply. High-resolution water use data, collected over a four-year period, revealed significant temporal variability. Monthly, daily, and hourly water use patterns were well described by autoregressive moving average (ARMA) models. Model development was supported by unsupervised clustering analysis via self-organizing maps (SOMs) that revealed similarities of water use patterns and confirmed the time-series water use model attributes. The inclusion of ambient temperature and rainfall as model attributes improved ARMA model performance for daily and hourly water use from R2 ~0.86–0.87 to 0.94–0.97 and from R2 ~0.85–0.89 to 0.92–0.98, respectively. Water use predictions for an entire year forward in time was feasible demonstrating",2021,Water,Yang Zhou; Bilal Muhammad Khan; Jin Yong Choi; Yoram Cohen,10.3390/w13162312,,https://doi.org/10.3390/w13162312,openalex,energy based model robot learning,concept,ebm,,7,,2026-06-12T18:26:24Z,14.590,14.590
doi:10.1109/icra48891.2023.10161336,Learning Video-Conditioned Policies for Unseen Manipulation Tasks,,2023,2023 IEEE International Conference on Robotics and Automation (ICRA),Elliot Chane-Sane; Cordelia Schmid; Ivan Laptev,10.1109/icra48891.2023.10161336,,https://doi.org/10.1109/icra48891.2023.10161336,crossref,learning robot manipulation from human video,concept,human_data,,15,robot manipulation,2026-06-12T14:45:03Z,14.586,14.586
doi:10.1002/poi3.381,Moderating manipulation: Demystifying extremist tactics for gaming the (regulatory) system,"Abstract Due to its ease of scalability and broad applicability, the use of artificial intelligence (AI) and machine learning in platform management has gained prominence. This has led to widespread debates about the use of deplatforming as the default tool for repeated or severe violations of terms or service. But technologically deterministic approaches are not infallible and can be predictable based on their actions. This opens the door for manipulation of media content and technological affordances to become tactical options for actors seeking to subvert regulation. Existing discussions often neglect the topic of manipulation of content, algorithms, or platform affordances as a primary aspect of the strategies used by extremists in relation to the difficulties of moderation from a policy perspective. This study argues that it is essential to understand how extremists and conspiracy t",2023,Policy & Internet,Ashley A. Mattheis; Ashton Kingdon,10.1002/poi3.381,,https://doi.org/10.1002/poi3.381,crossref,diffusion policy robot manipulation,concept,diffusion,,13,diffusion policy; robot manipulation,2026-06-12T15:07:36Z,14.570,14.570
doi:10.3389/frobt.2021.627958,Do Privacy Concerns About Social Robots Affect Use Intentions? Evidence From an Experimental Vignette Study,"While the privacy implications of social robots have been increasingly discussed and privacy-sensitive robotics is becoming a research field within human–robot interaction, little empirical research has investigated privacy concerns about robots and the effect they have on behavioral intentions. To address this gap, we present the results of an experimental vignette study that includes antecedents from the privacy, robotics, technology adoption, and trust literature. Using linear regression analysis, with the privacy-invasiveness of a fictional but realistic robot as the key manipulation, we show that privacy concerns affect use intention significantly and negatively. Compared with earlier work done through a survey, where we found a robot privacy paradox, the experimental vignette approach allows for a more realistic and tangible assessment of respondents' concerns and behavioral intent",2021,Frontiers in Robotics and AI,Christoph Lutz; Aurelia Tamò-Larrieux,10.3389/frobt.2021.627958,,https://doi.org/10.3389/frobt.2021.627958,crossref,Gaussian splatting robot perception tool use robotics,concept,architecture_x_embodiment,,61,Gaussian splatting robot perception; tool use robotics; human robot interaction,2026-06-12T15:07:36Z,14.564,15.564
doi:10.3389/frobt.2021.726463,Rapidly Learning Generalizable and Robot-Agnostic Tool-Use Skills for a Wide Range of Tasks,"Many real-world applications require robots to use tools. However, robots lack the skills necessary to learn and perform many essential tool-use tasks. To this end, we present the TRansferrIng Skilled Tool Use Acquired Rapidly (TRI-STAR) framework for task-general robot tool use. TRI-STAR has three primary components: 1) the ability to learn and apply tool-use skills to a wide variety of tasks from a minimal number of training demonstrations, 2) the ability to generalize learned skills to other tools and manipulated objects, and 3) the ability to transfer learned skills to other robots. These capabilities are enabled by TRI-STAR’s task-oriented approach, which identifies and leverages structural task knowledge through the use of our goal-based task taxonomy. We demonstrate this framework with seven tasks that impose distinct requirements on the usages of the tools, six of which were each",2021,Frontiers in Robotics and AI,Meiying Qin; Jake Brawer; Brian Scassellati,10.3389/frobt.2021.726463,,https://doi.org/10.3389/frobt.2021.726463,crossref,online adaptation robot learning,concept,adaptation,,7,online adaptation,2026-06-12T15:07:36Z,14.540,15.540
doi:10.3390/e22050564,Goal-Directed Planning for Habituated Agents by Active Inference Using a Variational Recurrent Neural Network,"It is crucial to ask how agents can achieve goals by generating action plans using only partial models of the world acquired through habituated sensory-motor experiences. Although many existing robotics studies use a forward model framework, there are generalization issues with high degrees of freedom. The current study shows that the predictive coding (PC) and active inference (AIF) frameworks, which employ a generative model, can develop better generalization by learning a prior distribution in a low dimensional latent state space representing probabilistic structures extracted from well habituated sensory-motor trajectories. In our proposed model, learning is carried out by inferring optimal latent variables as well as synaptic weights for maximizing the evidence lower bound, while goal-directed planning is accomplished by inferring latent variables for maximizing the estimated lower ",2020,Entropy,Takazumi Matsumoto; Jun Tani,10.3390/e22050564,,https://doi.org/10.3390/e22050564,openalex,energy based model robot learning,concept,ebm,,38,generalization,2026-06-12T18:26:24Z,14.532,15.532
doi:10.1109/tro.2021.3091282,"A Mechanical Screwing Tool for Parallel Grippers—Design, Optimization, and Manipulation Policies",,2022,IEEE Transactions on Robotics,Zhengtao Hu; Weiwei Wan; Keisuke Koyama; Kensuke Harada,10.1109/tro.2021.3091282,,https://doi.org/10.1109/tro.2021.3091282,crossref,robot world models manipulation,concept,world_models,,20,robot world model,2026-06-12T15:07:36Z,14.522,14.522
arxiv:2602.00557v1,ConLA: Contrastive Latent Action Learning from Human Videos for Robotic Manipulation,"Vision-Language-Action (VLA) models achieve preliminary generalization through pretraining on large scale robot teleoperation datasets. However, acquiring datasets that comprehensively cover diverse tasks and environments is extremely costly and difficult to scale. In contrast, human demonstration videos offer a rich and scalable source of diverse scenes and manipulation behaviors, yet their lack of explicit action supervision hinders direct utilization. Prior work leverages VQ-VAE based frameworks to learn latent actions from human videos in an unsupervised manner. Nevertheless, since the training objective primarily focuses on reconstructing visual appearances rather than capturing inter-frame dynamics, the learned representations tend to rely on spurious visual cues, leading to shortcut learning and entangled latent representations that hinder transferability. To address this, we prop",2026,arXiv,Weisheng Dai; Kai Lan; Jianyi Zhou; Bo Zhao; Xiu Su; Junwen Tong; Weili Guan; Shuo Yang,,2602.00557v1,http://arxiv.org/abs/2602.00557v1,arxiv,learning robot manipulation from human video,concept,human_data,,,robot manipulation; human demonstration; teleoperation; benchmark; generalization; shortcut learning,2026-06-12T14:45:03Z,14.500,16.500
arxiv:2603.04531v2,PTLD: Sim-to-real Privileged Tactile Latent Distillation for Dexterous Manipulation,"Tactile dexterous manipulation is essential to automating complex household tasks, yet learning effective control policies remains a challenge. While recent work has relied on imitation learning, obtaining high quality demonstrations for multi-fingered hands via robot teleoperation or kinesthetic teaching is prohibitive. Alternatively, with reinforcement we can learn skills in simulation, but fast and realistic simulation of tactile observations is challenging. To bridge this gap, we introduce PTLD: sim-to-real Privileged Tactile Latent Distillation, a novel approach to learning tactile manipulation skills without requiring tactile simulation. Instead of simulating tactile sensors or relying purely on proprioceptive policies to transfer zero-shot sim-to-real, our key idea is to leverage privileged sensors in the real world to collect real-world tactile policy data. This data is then used",2026,arXiv,Rosy Chen; Mustafa Mukadam; Michael Kaess; Tingfan Wu; Francois R Hogan; Jitendra Malik; Akash Sharma,,2603.04531v2,http://arxiv.org/abs/2603.04531v2,arxiv,sim to real robot manipulation,concept,sim2real,,,robot manipulation; dexterous manipulation; proprioception; imitation learning; teleoperation; benchmark,2026-06-12T14:45:03Z,14.500,17.500
arxiv:2605.21258v1,Learning Structural Latent Points for Efficient Visual Representations in Robotic Manipulation,"Current 3D-aware pretraining methods for embodied perception and manipulation are largely built on differentiable rendering frameworks, producing either fully implicit neural fields or fully explicit geometric primitives. Implicit representations, while expressive, lack explicit structural cues, whereas explicit ones preserve geometry but suffer from resolution limits and weak generalization. To address these limitations, we propose a novel pretraining framework that learns a hybrid representation-structural latent points. Specifically, we insert a point-wise latent variational autoencoder into the latent space of a point-cloud autoencoder, jointly regularizing point-wise features and coordinates toward a Gaussian prior. The resulting compact latent preserves coarse structural tendencies, which do not encode precise geometry but capture richer rough shape and semantic information, effect",2026,arXiv,Yicheng Jiang; Jiaxu Wang; Junhao He; Zesen Gan; Junhao Li; Qiang Zhang; Jingkai Sun; Jiahang Cao; Mingyuan Sun; Xiangyu Yue; Qiming Shao,,2605.21258v1,http://arxiv.org/abs/2605.21258v1,arxiv,latent dynamics model robotics,concept,architecture,,,latent dynamics model robotics; limitation; generalization; robustness; sample efficiency; ablation,2026-06-12T14:45:03Z,14.500,18.500
arxiv:2504.04612v2,Tool-as-Interface: Learning Robot Policies from Observing Human Tool Use,"Tool use is essential for enabling robots to perform complex real-world tasks, but learning such skills requires extensive datasets. While teleoperation is widely used, it is slow, delay-sensitive, and poorly suited for dynamic tasks. In contrast, human videos provide a natural way for data collection without specialized hardware, though they pose challenges on robot learning due to viewpoint variations and embodiment gaps. To address these challenges, we propose a framework that transfers tool-use knowledge from humans to robots. To improve the policy's robustness to viewpoint variations, we use two RGB cameras to reconstruct 3D scenes and apply Gaussian splatting for novel view synthesis. We reduce the embodiment gap using segmented observations and tool-centric, task-space actions to achieve embodiment-invariant visuomotor policy learning. We demonstrate our framework's effectiveness ",2025,arXiv,Haonan Chen; Cheng Zhu; Shuijing Liu; Yunzhu Li; Katherine Driggs-Campbell,,2504.04612v2,http://arxiv.org/abs/2504.04612v2,arxiv,Gaussian splatting robot perception tool use robotics,concept,architecture_x_embodiment,,,Gaussian splatting robot perception; tool use robotics; teleoperation; generalization; robustness,2026-06-12T15:07:36Z,14.500,17.500
doi:10.1016/j.resourpol.2022.102767,Patterns and features of embodied environmental flow networks in the international trade of metal resources: A study of aluminum,,2022,Resources Policy,Jinghan Di; Zongguo Wen; Meihui Jiang; Alessio Miatto,10.1016/j.resourpol.2022.102767,,https://doi.org/10.1016/j.resourpol.2022.102767,crossref,flow matching policy,concept,architecture,,19,flow matching policy,2026-06-12T15:07:36Z,14.498,14.498
doi:10.48550/arxiv.2402.04647,Latent Plan Transformer for Trajectory Abstraction: Planning as Latent Space Inference,"In tasks aiming for long-term returns, planning becomes essential. We study generative modeling for planning with datasets repurposed from offline reinforcement learning. Specifically, we identify temporal consistency in the absence of step-wise rewards as one key technical challenge. We introduce the Latent Plan Transformer (LPT), a novel model that leverages a latent variable to connect a Transformer-based trajectory generator and the final return. LPT can be learned with maximum likelihood estimation on trajectory-return pairs. In learning, posterior sampling of the latent variable naturally integrates sub-trajectories to form a consistent abstraction despite the finite context. At test time, the latent variable is inferred from an expected return before policy execution, realizing the idea of planning as inference. Our experiments demonstrate that LPT can discover improved decisions ",2024,arXiv (Cornell University),Deqian Kong; Dehong Xu; Minglu Zhao; Bo Pang; Jianwen Xie; Andrew Lizarraga; Yuhao Huang; Sirui Xie; Ying Wu,10.48550/arxiv.2402.04647,,https://doi.org/10.48550/arxiv.2402.04647,openalex,energy based transformer robot policy,concept,ebm_transformer,,1,energy based transformer robot policy; offline reinforcement learning; benchmark,2026-06-12T18:05:07Z,14.497,15.497
doi:10.48550/arxiv.2406.01968,Cross-Embodiment Robot Manipulation Skill Transfer using Latent Space Alignment,"This paper focuses on transferring control policies between robot manipulators with different morphology. While reinforcement learning (RL) methods have shown successful results in robot manipulation tasks, transferring a trained policy from simulation to a real robot or deploying it on a robot with different states, actions, or kinematics is challenging. To achieve cross-embodiment policy transfer, our key insight is to project the state and action spaces of the source and target robots to a common latent space representation. We first introduce encoders and decoders to associate the states and actions of the source robot with a latent space. The encoders, decoders, and a latent space control policy are trained simultaneously using loss functions measuring task performance, latent dynamics consistency, and encoder-decoder ability to reconstruct the original states and actions. To transf",2024,arXiv (Cornell University),Tianyu Wang; Dwait Bhatt; Xiaolong Wang; Nikolay Atanasov,10.48550/arxiv.2406.01968,,https://doi.org/10.48550/arxiv.2406.01968,openalex,energy based transformer robot policy,concept,ebm_transformer,,1,energy based transformer robot policy; robot manipulation; cross embodiment transfer,2026-06-12T18:05:07Z,14.497,14.497
doi:10.1371/journal.pcbi.1011791,BCI Toolbox: An open-source python package for the Bayesian causal inference model,"Psychological and neuroscientific research over the past two decades has shown that the Bayesian causal inference (BCI) is a potential unifying theory that can account for a wide range of perceptual and sensorimotor processes in humans. Therefore, we introduce the BCI Toolbox, a statistical and analytical tool in Python, enabling researchers to conveniently perform quantitative modeling and analysis of behavioral data. Additionally, we describe the algorithm of the BCI model and test its stability and reliability via parameter recovery. The present BCI toolbox offers a robust platform for BCI model implementation as well as a hands-on tool for learning and understanding the model, facilitating its widespread use and enabling researchers to delve into the data to uncover underlying cognitive mechanisms.",2024,PLOS Computational Biology,Haocheng Zhu; Ulrik Beierholm; Ladan Shams,10.1371/journal.pcbi.1011791,,https://doi.org/10.1371/journal.pcbi.1011791,crossref,causal robot world model,concept,architecture,,7,robot world model; causal robot world model,2026-06-12T15:07:36Z,14.490,15.490
doi:10.32604/rig.2023.047627,Mapping of Land Use and Land Cover (LULC) Using EuroSAT and Transfer Learning,"As the global population continues to expand, the demand for natural resources increases. Unfortunately, human activities account for 23% of greenhouse gas emissions. On a positive note, remote sensing technologies have emerged as a valuable tool in managing our environment. These technologies allow us to monitor land use, plan urban areas, and drive advancements in areas such as agriculture, climate change mitigation, disaster recovery, and environmental monitoring. Recent advances in Artificial Intelligence (AI), computer vision, and earth observation data have enabled unprecedented accuracy in land use mapping. By using transfer learning and fine-tuning with red-green-blue (RGB) bands, we achieved an impressive 99.19% accuracy in land use analysis. Such findings can be used to inform conservation and urban planning policies.",2024,Revue internationale de géomatique,Suman Kunwar; Jannatul Ferdush,10.32604/rig.2023.047627,,https://doi.org/10.32604/rig.2023.047627,openalex,energy based transformer robot policy,concept,ebm_transformer,,6,energy based transformer robot policy,2026-06-12T18:05:07Z,14.473,14.473
doi:10.1109/iros47612.2022.9982065,Feel the Tension: Manipulation of Deformable Linear Objects in Environments with Fixtures using Force Information,,2022,2022 IEEE/RSJ International Conference on Intelligent Robots and Systems (IROS),Finn Süberkrüb; Rita Laezza; Yiannis Karayiannidis,10.1109/iros47612.2022.9982065,,https://doi.org/10.1109/iros47612.2022.9982065,crossref,deformable object manipulation robot learning,concept,deformable,,18,deformable object manipulation,2026-06-12T15:07:36Z,14.472,14.472
doi:10.1109/lra.2018.2849876,Passive Virtual Fixtures Adaptation in Minimally Invasive Robotic Surgery,"During robot-aided surgical interventions, the surgeon can be benefitted from the application of virtual fixtures (VFs). Though very effective, this technique is very often not practicable in unstructured surgical environments. In order to comply with the environmental deformation, both the VF geometry and the constraint enforcement parameters need to be online defined/adapted. This letter proposes a strategy for an effective use of VF assistance in minimally invasive robotic surgical tasks. An online VF generation technique based on the interaction force measurements is presented. Pose and geometry adaptations of the VF are considered. Passivity of the overall system is guaranteed by using energy tanks passivity-based control. The proposed method is validated through experiments on the da Vinci Research Kit.",2018,IEEE Robotics and Automation Letters,Mario Selvaggio; Giuseppe Andrea Fontanelli; Fanny Ficuciello; Luigi Villani; Bruno Siciliano,10.1109/lra.2018.2849876,,https://doi.org/10.1109/lra.2018.2849876,openalex,robotics,concept,openalex_bulk_robotics,,76,,2026-06-12T18:57:17Z,14.472,14.472
doi:10.1371/journal.pcbi.1011406,Simulation-based inference for efficient identification of generative models in computational connectomics,"Recent advances in connectomics research enable the acquisition of increasing amounts of data about the connectivity patterns of neurons. How can we use this wealth of data to efficiently derive and test hypotheses about the principles underlying these patterns? A common approach is to simulate neuronal networks using a hypothesized wiring rule in a generative model and to compare the resulting synthetic data with empirical data. However, most wiring rules have at least some free parameters, and identifying parameters that reproduce empirical data can be challenging as it often requires manual parameter tuning. Here, we propose to use simulation-based Bayesian inference (SBI) to address this challenge. Rather than optimizing a fixed wiring rule to fit the empirical data, SBI considers many parametrizations of a rule and performs Bayesian inference to identify the parameters that are comp",2023,PLoS Computational Biology,Jan Boelts; Philipp Harth; Richard Gao; Daniel Udvary; Felipe Yáñez; Daniel Baum; Hans‐Christian Hege; Marcel Oberlaender; Jakob H. Macke,10.1371/journal.pcbi.1011406,,https://doi.org/10.1371/journal.pcbi.1011406,openalex,energy based model robot learning,concept,ebm,,9,,2026-06-12T18:26:24Z,14.451,14.451
doi:10.1049/itr2.12201,Intelligent train operation based on deep learning from excellent driver manipulation patterns,"Abstract In the application of deep learning to realize intelligent train operation, there are some problems, such as the single learning task. Especially when using the gradient descent approach to optimize the structure, weight and threshold of a deep network, it is easy in this task to fall into a local optimum. This leads to excessive reliance on manual tuning experience. Aiming at the above issues, this paper proposes a new approach of train manipulation and prediction based on a long short‐term memory (LSTM) deep network. From the perspective of automatic hyper‐parameter optimization, the gradient‐free intelligent search method is principally chosen to optimize the architecture and parameters of a LSTM deep network, so as to improve the manipulation accuracy based on learning from excellent drivers. This method first selects excellent driver data through the Pareto dominance princi",2022,IET Intelligent Transport Systems,Kai Xu; Yongchao Tu; Wenxuan Xu; Shixun Wu,10.1049/itr2.12201,,https://doi.org/10.1049/itr2.12201,crossref,contact rich manipulation learning,concept,contact,,8,contact rich manipulation; robustness,2026-06-12T15:07:36Z,14.449,15.449
doi:10.1007/978-3-540-48113-3_5,Haptic Virtual Fixtures for Robot-Assisted Manipulation,,2007,Springer tracts in advanced robotics,Jake J. Abbott; Panadda Marayong; Allison M. Okamura,10.1007/978-3-540-48113-3_5,,https://doi.org/10.1007/978-3-540-48113-3_5,openalex,robotics,concept,openalex_bulk_robotics,,268,,2026-06-12T18:57:17Z,14.447,14.447
