uid,title,abstract,year,venue,authors,doi,arxiv_id,url,source,query,query_role,family,advisor_seed,citation_count,matched_terms,retrieved_at,relevance_score,hostile_score
doi:10.31224/osf.io/dqg7m,Achieving dexterous manipulation for minimally invasive surgical robots through the use of hydraulics,"Existing robotic surgical platforms face limitations which include the balance between the scale of the robot and its capability in terms of range of motion, load capacity, and tool manipulation. These limitations can be overcome by taking advantage of fluid power as an enabling technology with its inherent power density and controllability. As a proof-of-concept for this approach, we are pursuing the design of a novel, dexterous robotic surgical tool targeted towards transgastric natural orifice surgery.The design for this hydraulic surgical platform and the corresponding analysis are presented to demonstrate the theoretical system performance in terms of tool positioning and input requirements. The design involves a combination of a novel 3D valve, hydraulic artificial muscles, and multi-segmented flexible manipulator arms that fit in the lumen of an endoscope. A dynamic model of the s",,,Devin R. Berg; Perry Y. Li; Arthur G. Erdman,10.31224/osf.io/dqg7m,,https://doi.org/10.31224/osf.io/dqg7m,crossref,EBM transformer robotics dexterous manipulation,concept,architecture_x_embodiment,,,EBM transformer robotics; dexterous manipulation; surgical robot; limitation,2026-06-12T15:07:36Z,14.300,15.300
doi:10.1142/s2661341725740827,Perception of Rheumatoid Arthritis Patients on the Use of Telemedicine Utilizing a Telemedicine Perception Survey Tool,"Background: Studying the perception of Rheumatoid arthritis (RA) patients towards telemedicine follow-ups through a Telemedicine Perception Survey Tool is invaluable for several reasons. It enables an understanding of how RA patients perceive telemedicine, aiding in the customization of healthcare services to better meet their needs. Moreover, it facilitates the evaluation of patient perceptions, thereby assessing the extent to which telemedicine enhances convenience and accessibility to care, such as by reducing travel burdens and offering flexibility in appointment scheduling. Additionally, this study evaluates the effectiveness of telemedicine in delivering quality care and identifies barriers or challenges specific to its use for RA follow-ups. From a policymaker’s perspective, such research serves as a vital tool for gathering firsthand feedback and assists in tailoring telemedicine",2025,Journal of Clinical Rheumatology and Immunology,Rica Kezia King; Paul Santos Estrella,10.1142/s2661341725740827,,https://doi.org/10.1142/s2661341725740827,crossref,Gaussian splatting robot perception tool use robotics,concept,architecture_x_embodiment,,,Gaussian splatting robot perception; tool use robotics,2026-06-12T15:07:36Z,14.300,15.300
doi:10.54371/jiip.v8i10.9495,Students' Perception on the Use of Canva as a Presentation Tool: The Study at SMA Srijaya Negara Palembang,"In the context of 21st-century learning, the integration of digital tools is essential to enhance student engagement and academic success. The aim of this study is to investigates students’ perceptions of using Canva as a presentation tool in English language learning at SMA Srijaya Negara Palembang. The research employed a quantitative descriptive method using a closed-ended questionnaire that covered three indicators: Perceived Usefulness (PU), Perceived Ease of Use (PEOU), and Behavioral Intention (BI). The participants consisted of 91 tenth-grade students, and the collected data were analyzed statistically to obtain mean scores and standard deviations on a 7-point Likert scale. The results showed that students’ perceptions were consistently in the “High” category, with mean scores of 5.78 for PU, 5.77 for PEOU, and 5.70 for BI. These findings indicate that students perceive Canva as ",2025,JIIP - Jurnal Ilmiah Ilmu Pendidikan,Annisa Salsabila; Amrullah Amrullah,10.54371/jiip.v8i10.9495,,https://doi.org/10.54371/jiip.v8i10.9495,crossref,Gaussian splatting robot perception tool use robotics,concept,architecture_x_embodiment,,,Gaussian splatting robot perception; tool use robotics,2026-06-12T15:07:36Z,14.300,14.300
doi:10.31234/osf.io/dfztu,Model-based foraging using latent-cause inference,"Foraging has been suggested to provide a more ecologicallyvalidcontext for studying decision-making. However, the environmentsused in human foraging tasks fail to capture thestructure of real world environments which contain multiplelevels of spatio-temporal regularities. We ask if foragers detectthese statistical regularities and use them to construct amodel of the environment that guides their patch-leaving decisions.We propose a model of how foragers might accomplishthis, and test its predictions in a foraging task with a structuredenvironment that includes patches of varying quality andpredictable transitions. Here, we show that human foragingdecisions reflect ongoing, statistically-optimal structure learning.Participants modulated decisions based on the current andpotential future context. From model fits to behavior, we canidentify an individual’s structure learning ability and rel",,,Nora Harhen; Catherine A. Hartley; Aaron Bornstein,10.31234/osf.io/dfztu,,https://doi.org/10.31234/osf.io/dfztu,crossref,latent dynamics model robotics,concept,architecture,,1,latent dynamics model robotics,2026-06-12T14:45:03Z,14.297,15.297
doi:10.1101/2021.03.19.435933,Optogenetic manipulation of individual or whole population Caenorhabditis elegans worms with an under hundred-dollar tool: the OptoArm,"Abstract Optogenetic tools have revolutionized the study of neuronal circuits in Caenorhabditis elegans. The expression of light-sensitive ion channels or pumps under specific promotors allows researchers to modify the behavior of excitable cells. Several optogenetic systems have been developed to spatially and temporally photoactivate light-sensitive actuators in C. elegans . Nevertheless, their high costs and low flexibility have limited wide access to optogenetics. Here, we developed an inexpensive, easy-to-build, and adjustable optogenetics device for use on different microscopes and worm trackers, called the OptoArm. The OptoArm allows for single- and multiple-worm illumination and is adaptable in terms of light intensity, lighting profiles and light-color. We demonstrate the OptoArm’s power in a population-based study on contributions of motor circuit cells to age-related motility ",,,M. Koopman; L. Janssen; E.A.A. Nollen,10.1101/2021.03.19.435933,,https://doi.org/10.1101/2021.03.19.435933,crossref,whole body manipulation humanoid,concept,humanoid,,1,,2026-06-12T15:07:36Z,14.297,14.297
doi:10.3758/s13414-025-03170-y,Spatially incompatible tool use does not induce tactile neglect,"Abstract Operating a tool that moves incompatibly with one’s own body invokes conflict between representations of anticipated body-related and environment-related movement consequences. To revolve such conflict, agents might down-regulate (or “neglect”) representations of body-related movement consequences during action preparation and execution. We tested body-related neglect by probing participants’ tactile sensitivity when operating a tool which moved either spatially compatible or incompatible to their operating hand. Across four experiments, we found no evidence for conflict-induced body-neglect. These results suggest that any potential downregulation of body-related movement components does not extend to the processing of tactile stimulation. We discuss these results with respect to applied settings in which incompatibly moving tools are routinely used.",2026,"Attention, Perception, & Psychophysics",Yanick Kloss; Wilfried Kunde,10.3758/s13414-025-03170-y,,https://doi.org/10.3758/s13414-025-03170-y,crossref,Gaussian splatting robot perception tool use robotics,concept,architecture_x_embodiment,,1,Gaussian splatting robot perception; tool use robotics,2026-06-12T15:07:36Z,14.297,14.297
doi:10.1016/j.mex.2023.102528,Validation of causal inference data using DirectLiNGAM in an environmental small-scale model and calculation settings,,2024,MethodsX,Atsushi Kurotani; Hirokuni Miyamoto; Jun Kikuchi,10.1016/j.mex.2023.102528,,https://doi.org/10.1016/j.mex.2023.102528,crossref,causal robot world model,concept,architecture,,5,robot world model; causal robot world model,2026-06-12T15:07:36Z,14.296,15.296
doi:10.1109/lra.2025.3598984,AffPose: An Integrated RGB-Based Framework for Simultaneous Pose Estimation and Affordance Detection in Robotic Tool Manipulation,,2025,IEEE Robotics and Automation Letters,Weijie Kong; Zhaohui Lin; Wei Yu; Haotian Guo; Zhian Su; Huixu Dong,10.1109/lra.2025.3598984,,https://doi.org/10.1109/lra.2025.3598984,crossref,robot world models manipulation,concept,world_models,,3,robot world model,2026-06-12T15:07:36Z,14.293,14.293
doi:10.3390/robotics11050104,Shelf Replenishment Based on Object Arrangement Detection and Collapse Prediction for Bimanual Manipulation,"Object manipulation automation in logistic warehouses has recently been actively researched. However, shelf replenishment is a challenge that requires the precise and careful handling of densely piled objects. The irregular arrangement of objects on a shelf makes this task particularly difficult. This paper presents an approach for generating a safe replenishment process from a single depth image, which is provided as an input to two networks to identify arrangement patterns and predict the occurrence of collapsing objects. The proposed inference-based strategy provides an appropriate decision and course of action on whether to create an insertion space while considering the safety of the shelf content. In particular, we exploit the bimanual dexterous manipulation capabilities of the associated robot to resolve the task safely, without re-organizing the entire shelf. Experiments with a r",2022,Robotics,Tomohiro Motoda; Damien Petit; Takao Nishi; Kazuyuki Nagata; Weiwei Wan; Kensuke Harada,10.3390/robotics11050104,,https://doi.org/10.3390/robotics11050104,crossref,physical reasoning robotics manipulation,concept,physical_reasoning,,11,dexterous manipulation; bimanual manipulation,2026-06-12T14:45:03Z,14.292,14.292
doi:10.1109/ro-man53752.2022.9900599,Task-Oriented Robot-to-Human Handovers in Collaborative Tool-Use Tasks,,2022,2022 31st IEEE International Conference on Robot and Human Interactive Communication (RO-MAN),Meiying Qin; Jake Brawer; Brian Scassellati,10.1109/ro-man53752.2022.9900599,,https://doi.org/10.1109/ro-man53752.2022.9900599,crossref,interactive robot learning human feedback,concept,hri,,12,,2026-06-12T15:07:36Z,14.282,14.282
doi:10.1016/j.enpol.2003.08.017,Design of coordinated energy and environmental policies: use of multi-criteria decision-making,,2004,Energy Policy,Lorna A Greening; Steve Bernow,10.1016/j.enpol.2003.08.017,,https://doi.org/10.1016/j.enpol.2003.08.017,crossref,energy based policy robotics,concept,ebm,,202,,2026-06-12T17:50:07Z,14.257,14.257
doi:10.1177/17470218231160910,Sound–action symbolism in relation to precision manipulation and whole-hand grasp usage,"It has been suggested that actions can provide a fruitful conceptual context for sound symbolism phenomena, and that tight interaction between manual and articulatory processes might cause that hand actions, in particular, are sound-symbolically associated with specific speech sounds. Experiment 1 investigated whether novel words, built from speech sounds that have been previously linked to precision or power grasp responses, are implicitly associated with perceived actions that present precision manipulation or whole-hand grasp tool-use or the corresponding utilisation pantomimes. In the two-alternative forced-choice task, the participants were more likely to match novel words to tool-use actions and corresponding pantomimes that were sound-symbolically congruent with the words. Experiment 2 showed that the same or even larger sound–action symbolism effect can be observed when the panto",2024,Quarterly Journal of Experimental Psychology,Lari Vainio; Markku Kilpeläinen; Alexandra Wikström; Martti Vainio,10.1177/17470218231160910,,https://doi.org/10.1177/17470218231160910,crossref,whole body manipulation humanoid,concept,humanoid,,4,,2026-06-12T15:07:36Z,14.255,14.255
doi:10.3390/e23050552,Inference and Learning in a Latent Variable Model for Beta Distributed Interval Data,"Latent Variable Models (LVMs) are well established tools to accomplish a range of different data processing tasks. Applications exploit the ability of LVMs to identify latent data structure in order to improve data (e.g., through denoising) or to estimate the relation between latent causes and measurements in medical data. In the latter case, LVMs in the form of noisy-OR Bayes nets represent the standard approach to relate binary latents (which represent diseases) to binary observables (which represent symptoms). Bayes nets with binary representation for symptoms may be perceived as a coarse approximation, however. In practice, real disease symptoms can range from absent over mild and intermediate to very severe. Therefore, using diseases/symptoms relations as motivation, we here ask how standard noisy-OR Bayes nets can be generalized to incorporate continuous observables, e.g., variable",2021,Entropy,Hamid Mousavi; Mareike Buhl; Enrico Guiraud; Jakob Drefs; Jörg Lücke,10.3390/e23050552,,https://doi.org/10.3390/e23050552,crossref,latent dynamics model robotics,concept,architecture,,8,latent dynamics model robotics,2026-06-12T15:07:36Z,14.249,14.249
doi:10.1109/cis-ram55796.2023.10370763,Wafer Map Defect Patterns Semi-Supervised Classification Using Latent Vector Representation,,2023,"2023 IEEE International Conference on Cybernetics and Intelligent Systems (CIS) and IEEE Conference on Robotics, Automation and Mechatronics (RAM)",Qiyu Wei; Wei Zhao; Xiaoyan Zheng; Zeng Zeng,10.1109/cis-ram55796.2023.10370763,,https://doi.org/10.1109/cis-ram55796.2023.10370763,crossref,latent dynamics model robotics,concept,architecture,,7,latent dynamics model robotics,2026-06-12T15:07:36Z,14.240,14.240
doi:10.1016/j.enpol.2023.113771,Environmental impacts of household energy use in ASEAN-5 countries: Are there asymmetric effects?,,2023,Energy Policy,Mahelet G. Fikru; Khalid M. Kisswani,10.1016/j.enpol.2023.113771,,https://doi.org/10.1016/j.enpol.2023.113771,crossref,energy based policy robotics,concept,ebm,,7,,2026-06-12T17:50:07Z,14.240,14.240
doi:10.2514/1.j062533,Latent Representation of Computational Fluid Dynamics Meshes and Application to Airfoil Aerodynamics,"Mesh manipulation is central to computational fluid dynamics. However, creating appropriate computational meshes often involves substantial manual intervention that has to be repeated each time the target shape changes. To address this problem, we propose an autodecoder-based latent representation approach. Human prior knowledge is embedded into learned geometric patterns, which eliminates the need for further handcrafting. Furthermore, the resulting computational meshes are differentiable with respect to the model parameters, which makes it suitable for inclusion in end-to-end trainable pipelines. We apply the model on two-dimensional airfoils to demonstrate its ability to handle various tasks.",2023,AIAA Journal,Zhen Wei; Benoît Guillard; Pascal Fua; Vincent Chapin; Michaël Bauerheim,10.2514/1.j062533,,https://doi.org/10.2514/1.j062533,crossref,latent dynamics model robotics,concept,architecture,,6,latent dynamics model robotics,2026-06-12T15:07:36Z,14.223,14.223
doi:10.1109/robot.2000.844040,TerminatorBot: a robot with dual-use arms for manipulation and locomotion,"A novel, miniature robot designed to use its two arms for both manipulation and locomotion is described. Intended for military and civilian surveillance and search-and-rescue applications, the robot must be small, rugged, and lightweight, hence the desire for dual-use. The robot consists of two, three-degree-of-freedom arms that can stow completely inside the 75 mm diameter cylindrical body for ballistic deployment. This paper describes the mechanism and design motivation as well as two novel locomotion gaits and a third conventional gait.",2002,,Richard M. Voyles,10.1109/robot.2000.844040,,https://doi.org/10.1109/robot.2000.844040,openalex,robotics,concept,openalex_bulk_robotics,,41,deployment,2026-06-12T18:57:17Z,14.219,15.219
doi:10.3390/ijerph18116157,UNRAQ—A Questionnaire for the Use of a Social Robot in Care for Older Persons. A Multi-Stakeholder Study and Psychometric Properties,"(1) Background: while there exist validated measures to assess the needs of older people, there are comparatively few validated tools to assess needs and requirements for the use of robots. Henceforth, the aim of the study is to present and validate such a tool. (2) Methods: The study group included 720 subjects (mean age 52.0 ± 37.0, 541 females) who agreed to fill the Users' Needs, Requirements, and Abilities Questionnaire (UNRAQ). The validation part of the study included 125 persons. (3) Results: the acceptance of the robot was good in the whole group. The social functions were rated worse than assistive ones. A correlation was found between the scores of social and assistive functions. The respondents claimed that older adults were not prepared to interact with the robot and not very good at handling it, and were sceptical about their willingness to learn to operate the robot. The C",2021,International Journal of Environmental Research and Public Health,Sławomir Tobis; Agnieszka Neumann‐Podczaska; Sylwia Kropińska; Aleksandra Suwalska,10.3390/ijerph18116157,,https://doi.org/10.3390/ijerph18116157,openalex,robotics,concept,openalex_bulk_robotics,,27,,2026-06-12T18:57:17Z,14.216,14.216
title:super a surgical perception framework for endoscopic tissue manipulation with surgical robotics,SuPer: A Surgical Perception Framework for Endoscopic Tissue Manipulation With Surgical Robotics,"Traditional control and task automation have been successfully demonstrated in a variety of structured, controlled environments through the use of highly specialized modeled robotic systems in conjunction with multiple sensors.However, the application of autonomy in endoscopic surgery is very challenging, particularly in soft tissue work, due to the lack of high-quality images and the unpredictable, constantly deforming environment.In this letter, we propose a novel surgical perception framework, SuPer, for surgical robotic control.This framework continuously collects 3D geometric information that allows for mapping a deformable surgical field while tracking rigid instruments within the field.To achieve this, a model-based tracker is employed to localize the surgical tool with a kinematic prior in conjunction with a model-free tracker to reconstruct the deformable environment and provide",2020,eScholarship (California Digital Library),"Li, Yang; Richter, Florian; Lu, Jingpei; Funk, Emily K; Orosco, Ryan K; Zhu, Jianke; Yip, Michael C",,,https://openalex.org/W3099462921,openalex,robotics,concept,openalex_bulk_robotics,,40,surgical robot,2026-06-12T18:57:17Z,14.207,14.207
doi:10.1007/s00787-019-01318-4,The dynamics of adolescents’ pornography use and psychological well-being: a six-wave latent growth and latent class modeling approach,,2019,European Child & Adolescent Psychiatry,Aleksandar Štulhofer; Azra Tafro; Taylor Kohut,10.1007/s00787-019-01318-4,,https://doi.org/10.1007/s00787-019-01318-4,crossref,latent dynamics model robotics,concept,architecture,,36,latent dynamics model robotics,2026-06-12T15:07:36Z,14.205,14.205
doi:10.1109/mipr62202.2024.00042,Retrieval Augmented Structured Generation: Business Document Information Extraction as Tool Use,,2024,2024 IEEE 7th International Conference on Multimedia Information Processing and Retrieval (MIPR),Franz Louis Cesista; Rui Aguiar; Jason Kim; Paolo Acilo,10.1109/mipr62202.2024.00042,,https://doi.org/10.1109/mipr62202.2024.00042,crossref,retrieval augmented robot policy,concept,architecture,,4,retrieval augmented robot policy,2026-06-12T15:07:36Z,14.205,14.205
doi:10.1016/j.infbeh.2024.101925,Early object skill supports growth in role-differentiated bimanual manipulation in infants,,2024,Infant Behavior and Development,Megan A. Taylor; Stefany Coxe; Eliza L. Nelson,10.1016/j.infbeh.2024.101925,,https://doi.org/10.1016/j.infbeh.2024.101925,crossref,deformable object manipulation robot learning,concept,deformable,,4,bimanual manipulation; deformable object manipulation,2026-06-12T15:07:36Z,14.205,14.205
doi:10.5220/0006644604700477,The Wrong Tool for Inference - A Critical View of Gaussian Graphical Models,,2018,Proceedings of the 7th International Conference on Pattern Recognition Applications and Methods,Kevin R. Keane; Jason J. Corso,10.5220/0006644604700477,,https://doi.org/10.5220/0006644604700477,crossref,Gaussian splatting robot perception tool use robotics,concept,architecture_x_embodiment,,,Gaussian splatting robot perception; tool use robotics,2026-06-12T15:07:36Z,14.200,14.200
doi:10.1007/978-3-031-24670-8_10,Training School Teachers to Use Robots as an Educational Tool: The Impact on Robotics Perception,,2022,Lecture Notes in Computer Science Social Robotics,Giulia Pusceddu; Francesca Cocchella; Michela Bogliolo; Giulia Belgiovine; Linda Lastrico; Maura Casadio; Francesco Rea; Alessandra Sciutti,10.1007/978-3-031-24670-8_10,,https://doi.org/10.1007/978-3-031-24670-8_10,crossref,EBM transformer robotics tool use robotics,concept,architecture_x_embodiment,,10,EBM transformer robotics; tool use robotics,2026-06-12T15:07:36Z,14.199,14.199
doi:10.1109/lra.2022.3191793,Understanding Physical Effects for Effective Tool-Use,,2022,IEEE Robotics and Automation Letters,Zeyu Zhang; Ziyuan Jiao; Weiqi Wang; Yixin Zhu; Song-Chun Zhu; Hangxin Liu,10.1109/lra.2022.3191793,,https://doi.org/10.1109/lra.2022.3191793,crossref,EBM transformer robotics tool use robotics,concept,architecture_x_embodiment,,10,EBM transformer robotics; tool use robotics,2026-06-12T15:07:36Z,14.199,14.199
doi:10.3390/app14114434,VR Simulation and Implementation of Robotics: A Tool for Streamlining and Optimization,"This article explores the significance of simulation-based analysis in understanding the effectiveness of material handling strategies. By utilizing simulation models, businesses can optimize production processes, streamline flows, and enhance overall logistics efficiency. In today’s competitive market landscape, the significance of product manipulation cannot be overstated. It directly influences consumer perception and plays a pivotal role in gaining a competitive advantage. Simulation-based analysis has emerged as a powerful tool for optimizing production processes and enhancing logistics efficiency. Robotics sorting and loading offer increased accuracy, speed, and efficiency over manual processes. Their implementation boost productivity, cuts costs, and enhances working conditions. In today’s competitive market, effective product handling shapes consumer perception and competitivenes",2024,Applied Sciences,Simona Špirková; Martin Straka; Anna Saniuk,10.3390/app14114434,,https://doi.org/10.3390/app14114434,crossref,EBM transformer robotics tool use robotics,concept,architecture_x_embodiment,,8,EBM transformer robotics; tool use robotics,2026-06-12T15:07:36Z,14.199,14.199
doi:10.3390/robotics9010011,Towards Tethered Tool Manipulation Planning with the Help of a Tool Balancer,"Handling and maneuvering tools across a robot workspace is a challenging task that often requires the implementation of constrained motion planning. In the case of wired or tethered tools, their maneuvering becomes considerably harder by the tool cable. If the cable presence is not considered, the robot motions may make the cable become entangled with the robot arms or elements of its workspace, causing accidents or unnecessary strain on the robot and the tool. Furthermore, the behavior of the tool cable during manipulation and its degree of entanglement around the robot are difficult to predict. The present paper introduces a constrained manipulation planner for dual-armed tethered tool manipulation involving tool re-grasping. Our solution employs a tool balancer to straighten the tool cable and facilitate the cable deformation problem. The planner predicts the cable states during manip",2020,Robotics,Daniel Sanchez; Weiwei Wan; Kensuke Harada,10.3390/robotics9010011,,https://doi.org/10.3390/robotics9010011,crossref,physical reasoning robotics manipulation,concept,physical_reasoning,,5,motion planning,2026-06-12T14:45:03Z,14.196,15.196
