uid,title,abstract,year,venue,authors,doi,arxiv_id,url,source,query,query_role,family,advisor_seed,citation_count,matched_terms,retrieved_at,relevance_score,hostile_score
doi:10.48550/arxiv.2407.00451,Language-Guided Object-Centric Diffusion Policy for Generalizable and Collision-Aware Robotic Manipulation,"Learning from demonstrations faces challenges in generalizing beyond the training data and often lacks collision awareness. This paper introduces Lan-o3dp, a language-guided object-centric diffusion policy framework that can adapt to unseen situations such as cluttered scenes, shifting camera views, and ambiguous similar objects while offering training-free collision avoidance and achieving a high success rate with few demonstrations. We train a diffusion model conditioned on 3D point clouds of task-relevant objects to predict the robot's end-effector trajectories, enabling it to complete the tasks. During inference, we incorporate cost optimization into denoising steps to guide the generated trajectory to be collision-free. We leverage open-set segmentation to obtain the 3D point clouds of related objects. We use a large language model to identify the target objects and possible obstacl",2024,arXiv (Cornell University),"Hang Li; Qian Feng; Zhi Zheng; Jianxiang Feng; Chen, Zhaopeng; Knoll, Alois",10.48550/arxiv.2407.00451,,https://doi.org/10.48550/arxiv.2407.00451,openalex,energy based transformer robot policy,concept,ebm_transformer,,1,energy based transformer robot policy; diffusion policy; generalization,2026-06-12T18:05:07Z,15.847,16.847
doi:10.1088/1674-1056/ac00a1,Pitman–Yor process mixture model for community structure exploration considering latent interaction patterns*,"The statistical model for community detection is a promising research area in network analysis. Most existing statistical models of community detection are designed for networks with a known type of community structure, but in many practical situations, the types of community structures are unknown. To cope with unknown community structures, diverse types should be considered in one model. We propose a model that incorporates the latent interaction pattern, which is regarded as the basis of constructions of diverse community structures by us. The interaction pattern can parameterize various types of community structures in one model. A collapsed Gibbs sampling inference is proposed to estimate the community assignments and other hyper-parameters. With the Pitman–Yor process as a prior, our model can automatically detect the numbers and sizes of communities without a known type of communi",2021,Chinese Physics B,Jing Wang; Kan Li,10.1088/1674-1056/ac00a1,,https://doi.org/10.1088/1674-1056/ac00a1,crossref,latent dynamics model robotics,concept,architecture,,1,latent dynamics model robotics,2026-06-12T15:07:36Z,15.847,15.847
doi:10.3390/s19122712,Two-Stage Latent Dynamics Modeling and Filtering for Characterizing Individual Walking and Running Patterns with Smartphone Sensors,"Recently, data from built-in sensors in smartphones have been readily available, and analyzing data for various types of health information from smartphone users has become a popular health care application area. Among relevant issues in the area, one of the most prominent topics is analyzing the characteristics of human movements. In this paper, we focus on characterizing the human movements of walking and running based on a novel machine learning approach. Since walking and running are human fundamental activities, analyzing their characteristics promptly and automatically during daily smartphone use is particularly valuable. In this paper, we propose a machine learning approach, referred to as ’two-stage latent dynamics modeling and filtering’ (TS-LDMF) method, where we combine a latent space modeling stage with a nonlinear filtering stage, for characterizing individual dynamic walkin",2019,Sensors,Jaein Kim; Juwon Lee; Woongjin Jang; Seri Lee; Hongjoong Kim; Jooyoung Park,10.3390/s19122712,,https://doi.org/10.3390/s19122712,crossref,latent dynamics model robotics,concept,architecture,,3,latent dynamics model robotics,2026-06-12T15:07:36Z,15.793,15.793
doi:10.1177/0278364919872545,Learning task-oriented grasping for tool manipulation from simulated self-supervision,"Tool manipulation is vital for facilitating robots to complete challenging task goals. It requires reasoning about the desired effect of the task and, thus, properly grasping and manipulating the tool to achieve the task. Most work in robotics has focused on task-agnostic grasping, which optimizes for only grasp robustness without considering the subsequent manipulation tasks. In this article, we propose the Task-Oriented Grasping Network (TOG-Net) to jointly optimize both task-oriented grasping of a tool and the manipulation policy for that tool. The training process of the model is based on large-scale simulated self-supervision with procedurally generated tool objects. We perform both simulated and real-world experiments on two tool-based manipulation tasks: sweeping and hammering. Our model achieves overall 71.1% task success rate for sweeping and 80.0% task success rate for hammerin",2020,The International Journal of Robotics Research,Kuan Fang; Yuke Zhu; Animesh Garg; Andrey Kurenkov; Viraj Mehta; Li Fei-Fei; Silvio Savarese,10.1177/0278364919872545,,https://doi.org/10.1177/0278364919872545,crossref,physical reasoning robotics manipulation,concept,physical_reasoning,,138,robustness,2026-06-12T15:07:36Z,15.767,17.767
doi:10.1177/0278364911432895,Active Handrest: A large workspace tool for precision manipulation,"To address the limited dexterous workspace of the human hand, we have developed the Active Handrest. This device assists in precision manipulation tasks by extending a user’s dexterous workspace while providing ergonomic support for reduced fatigue. People use handrests to complete dexterous activities as routine as providing a signature. However, the dexterous workspace of the statically supported hand is somewhat limited. By providing consistent support over large workspaces the Active Handrest could be useful for performing precision tasks, such as surgery, upper limb rehabilitation, and machining. Our prototype Active Handrest is a planar, human–machine interface that provides support for the user’s wrist and arm while allowing the user to retain complete control over a grasped tool or manipulated device. The Active Handrest uses force input from the user’s hand, position input from ",2012,The International Journal of Robotics Research,Mark A Fehlberg; Brian T Gleeson; William R Provancher,10.1177/0278364911432895,,https://doi.org/10.1177/0278364911432895,crossref,physical reasoning robotics manipulation,concept,physical_reasoning,,8,,2026-06-12T15:07:36Z,15.749,15.749
doi:10.1016/j.biopsycho.2023.108741,Active inference as a theory of sentient behavior,"This review paper offers an overview of the history and future of active inference-a unifying perspective on action and perception. Active inference is based upon the idea that sentient behavior depends upon our brains' implicit use of internal models to predict, infer, and direct action. Our focus is upon the conceptual roots and development of this theory of (basic) sentience and does not follow a rigid chronological narrative. We trace the evolution from Helmholtzian ideas on unconscious inference, through to a contemporary understanding of action and perception. In doing so, we touch upon related perspectives, the neural underpinnings of active inference, and the opportunities for future development. Key steps in this development include the formulation of predictive coding models and related theories of neuronal message passing, the use of sequential models for planning and policy o",2024,Biological Psychology,Giovanni Pezzulo; Thomas Parr; Karl Friston,10.1016/j.biopsycho.2023.108741,,https://doi.org/10.1016/j.biopsycho.2023.108741,openalex,energy based policy robotics,concept,ebm,,83,,2026-06-12T18:05:07Z,15.715,15.715
doi:10.1145/2948064,A Probabilistic Lifestyle-Based Trajectory Model for Social Strength Inference from Human Trajectory Data,"With the pervasiveness of location-based social networks, it becomes increasingly important to consider the social characteristics of locations shared among persons. Several studies have been proposed to infer social strength by using trajectory similarity. However, these studies have two major shortcomings. First, they rely on the explicit co-occurrence of check-in locations. In this situation, a user pair of two friends who seldom share common locations or a user pair of two strangers who heavily share common visited locations will receive an unreliable estimation of the real social strength between them. Second, these studies do not consider how the overall trajectory patterns of users change with the varying of living styles. In this article, we propose a probabilistic generative model to mine latent lifestyle-related patterns from human trajectory data for inferring social strength.",2017,ACM Transactions on Information Systems,Wayne Xin Zhao; Ningnan Zhou; Wenhui Zhang; Ji-Rong Wen; Shan Wang; Edward Y. Chang,10.1145/2948064,,https://doi.org/10.1145/2948064,crossref,trajectory transformer,concept,architecture,,26,trajectory transformer,2026-06-12T15:07:36Z,15.698,15.698
doi:10.1177/0269881114538543,The NMDAr antagonist ketamine interferes with manipulation of information for transitive inference reasoning in non-human primates,"One of the most remarkable traits of highly encephalized animals is their ability to manipulate knowledge flexibly to infer logical relationships. Operationally, the corresponding cognitive process can be defined as reasoning. One hypothesis is that this process relies on the reverberating activity of glutamate neural circuits, sustained by NMDA receptor (NMDAr) mediated synaptic transmission, in both parietal and prefrontal areas. We trained two macaque monkeys to perform a form of deductive reasoning – the transitive inference task – in which they were required to learn the relationship between six adjacent items in a single session and then deduct the relationship between nonadjacent items that had not been paired in the learning phase. When the animals had learned the sequence, we administered systemically a subanaesthetic dose of ketamine (a NMDAr antagonist) and measured their perf",2014,Journal of Psychopharmacology,Emiliano Brunamonti; Valentina Mione; Fabio Di Bello; Paolo De Luna; Aldo Genovesio; Stefano Ferraina,10.1177/0269881114538543,,https://doi.org/10.1177/0269881114538543,crossref,physical reasoning robotics manipulation,concept,physical_reasoning,,15,,2026-06-12T15:07:36Z,15.686,15.686
doi:10.1177/1471082x18786289,Incomplete graphical model inference via latent tree aggregation,"Graphical network inference is used in many fields such as genomics or ecology to infer the conditional independence structure between variables, from measurements of gene expression or species abundances for instance. In many practical cases, not all variables involved in the network have been observed, and the samples are actually drawn from a distribution where some variables have been marginalized out. This challenges the sparsity assumption commonly made in graphical model inference, since marginalization yields locally dense structures, even when the original network is sparse. We present a procedure for inferring Gaussian graphical models when some variables are unobserved, that accounts both for the influence of missing variables and the low density of the original network. Our model is based on the aggregation of spanning trees, and the estimation procedure on the expectation-ma",2019,Statistical Modelling,Geneviéve Robin; Christophe Ambroise; Stéphane Robin,10.1177/1471082x18786289,,https://doi.org/10.1177/1471082x18786289,crossref,latent dynamics model robotics,concept,architecture,,2,latent dynamics model robotics,2026-06-12T15:07:36Z,15.649,15.649
doi:10.48550/arxiv.2304.11214,Exploring the Use of ChatGPT as a Tool for Learning and Assessment in Undergraduate Computer Science Curriculum: Opportunities and Challenges,"The application of Artificial intelligence for teaching and learning in the academic sphere is a trending subject of interest in the computing education. ChatGPT, as an AI-based tool, provides various advantages, such as heightened student involvement, cooperation, accessibility and availability. This paper addresses the prospects and obstacles associated with utilizing ChatGPT as a tool for learning and assessment in undergraduate Computer Science curriculum in particular to teaching and learning fundamental programming courses. Students having completed the course work for a Data Structures and Algorithms (a sophomore level course) participated in this study. Two groups of students were given programming challenges to solve within a short period of time. The control group (group A) had access to text books and notes of programming courses, however no Internet access was provided. Group",2023,arXiv (Cornell University),Basit Qureshi,10.48550/arxiv.2304.11214,,https://doi.org/10.48550/arxiv.2304.11214,openalex,energy based transformer robot policy,concept,ebm_transformer,,58,energy based transformer robot policy,2026-06-12T18:05:07Z,15.639,15.639
doi:10.1109/lra.2026.3677744,Grasp to Act: Dexterous Grasping for Tool Use in Dynamic Settings,,2026,IEEE Robotics and Automation Letters,Harsh Gupta; Mohammad Amin Mirzaee; Wenzhen Yuan,10.1109/lra.2026.3677744,,https://doi.org/10.1109/lra.2026.3677744,crossref,EBM transformer robotics dexterous manipulation,concept,architecture_x_embodiment,,,EBM transformer robotics; dexterous manipulation,2026-06-12T15:07:36Z,15.600,15.600
doi:10.1109/70.897786,"Lidar design, use, and calibration concepts for correct environmental detection",,2000,IEEE Transactions on Robotics and Automation,M.D. Adams,10.1109/70.897786,,https://doi.org/10.1109/70.897786,crossref,Gaussian splatting robot perception tool use robotics,concept,architecture_x_embodiment,,49,Gaussian splatting robot perception; tool use robotics,2026-06-12T15:07:36Z,15.556,15.556
doi:10.1007/s12008-023-01733-7,Machine learning tool for the prediction of electrode wear effect on the quality of resistance spot welds,"Abstract The quality of resistance spot welding (RSW) joints is strongly affected by the condition of the electrodes. This work develops a machine learning-based tool to automatically assess the influence of electrode wear on the quality of RSW welds. Two different experimental campaigns were performed to evaluate the effect of electrode wear on the mechanical strength of spot welds. The resulting failure load of the joints has been used to define the weld quality classes of the machine learning tool, while data from electrode displacement and electrode force sensors, embedded in the welding machine, have been processed to identify the predictors of the tool. Some machine learning algorithms have been tested. The most performing algorithm, i.e., the neural network, achieved an accuracy of 90%. This work provides important theoretical and practical contributions. First, the decreasing the",2024,International Journal on Interactive Design and Manufacturing (IJIDeM),Luigi Panza; Giulia Bruno; Gabriel Antal; Manuela De Maddis; Pasquale Russo Spena,10.1007/s12008-023-01733-7,,https://doi.org/10.1007/s12008-023-01733-7,openalex,energy based model robot learning,concept,ebm,,14,,2026-06-12T18:26:24Z,15.504,16.504
arxiv:2511.22904v1,Language-conditioned world model improves policy generalization by reading environmental descriptions,"To interact effectively with humans in the real world, it is important for agents to understand language that describes the dynamics of the environment--that is, how the environment behaves--rather than just task instructions specifying ""what to do"". Understanding this dynamics-descriptive language is important for human-agent interaction and agent behavior. Recent work address this problem using a model-based approach: language is incorporated into a world model, which is then used to learn a behavior policy. However, these existing methods either do not demonstrate policy generalization to unseen games or rely on limiting assumptions. For instance, assuming that the latency induced by inference-time planning is tolerable for the target task or expert demonstrations are available. Expanding on this line of research, we focus on improving policy generalization from a language-conditioned",2025,arXiv,Anh Nguyen; Stefan Lee,,2511.22904v1,http://arxiv.org/abs/2511.22904v1,arxiv,robot world models manipulation,concept,world_models,,,robot world model; generalization; deployment; latency,2026-06-12T14:45:03Z,15.500,18.500
doi:10.1177/21582440221099293,Effects of Resistance Barriers to Service Robots on Alternative Attractiveness and Intention to Use,"This study examined the effect of resistance barriers on alternative attractiveness of service robots and intention to use to explain the effect of innovation resistance against such robots on customer behavior. An online survey was conducted with South Korean customers who had used hotel rooms in the past year. This study tested its hypotheses with partial least squares–structural equation modeling. The results indicate that usage barriers related to customers’ familiarity with use and tradition as well as image barriers caused by psychological instability and decreased alternative attractiveness. However, the value and risk barriers based on technological level had no significant effect on alternative attractiveness. The results show that alternative attractiveness increases intention to use; however, alternative attractiveness affected by resistance barriers decreases intention to use",2022,SAGE Open,Gyutae Lee; Yunsik Kim,10.1177/21582440221099293,,https://doi.org/10.1177/21582440221099293,openalex,robotics,concept,openalex_bulk_robotics,,32,,2026-06-12T18:57:17Z,15.498,15.498
doi:10.1016/j.enpol.2022.112826,Does carbon financial market as an environmental regulation policy tool promote regional energy conservation and emission reduction? Empirical evidence from China,,2022,Energy Policy,Guangtong Gu; Haorong Zheng; Lingyun Tong; Yaxian Dai,10.1016/j.enpol.2022.112826,,https://doi.org/10.1016/j.enpol.2022.112826,crossref,energy based policy robotics,concept,ebm,,146,,2026-06-12T17:50:07Z,15.495,15.495
doi:10.1007/s11431-016-9094-y,Environmental analysis of innovative sustainable composites with potential use in aviation sector—A life cycle assessment review,"The forecast of growing air transport in the upcoming decades faces the challenge of an increasing environmental impact. Aviation industry is working on promising technologies to mitigate this environmental impact. Lightweight design is a strong lever to lower the fuel consumption and, consequently, with it the emissions of aviation. High performance composites are a key technology to help achieve these aims thanks to their favourable combination of mechanical properties and low weight in primary structures. However, mainly synthetic materials such as petrol based carbon fibres and epoxy resins are used nowadays to produce composite in aviation. Renewable materials like bio-based fibres and resin systems offer potential environmental advantages. However, they have not found their way into aviation, yet. The reasons are reduced mechanical properties and, especially for the use of natural ",2017,Science China Technological Sciences,Jens Bachmann; Carme Hidalgo; Stéphanie Bricout,10.1007/s11431-016-9094-y,,https://doi.org/10.1007/s11431-016-9094-y,openalex,energy based policy robotics,concept,ebm,,233,,2026-06-12T18:43:24Z,15.478,15.478
doi:10.1109/tro.2008.924947,A Control Framework to Generate Nonenergy-Storing Virtual Fixtures: Use of Simulated Plasticity,,2008,IEEE Transactions on Robotics,R. Kikuuwe; N. Takesue; H. Fujimoto,10.1109/tro.2008.924947,,https://doi.org/10.1109/tro.2008.924947,crossref,Gaussian splatting robot perception tool use robotics,concept,architecture_x_embodiment,,40,Gaussian splatting robot perception; tool use robotics,2026-06-12T15:07:36Z,15.457,15.457
doi:10.1109/icra.2014.6907206,Online contact point estimation for uncalibrated tool use,,2014,2014 IEEE International Conference on Robotics and Automation (ICRA),Yiannis Karayiannidis; Christian Smith; Francisco E. Vina; Danica Kragic,10.1109/icra.2014.6907206,,https://doi.org/10.1109/icra.2014.6907206,crossref,EBM transformer robotics contact rich manipulation,concept,architecture_x_embodiment,,36,EBM transformer robotics; contact rich manipulation,2026-06-12T15:07:36Z,15.405,15.405
doi:10.1007/978-3-031-76424-0_2,Design and Radiation Resistance Analysis of a Robotic Bolting Tool Applied to IFMIF-DONES Maintenance,,2024,Springer Proceedings in Advanced Robotics European Robotics Forum 2024,Manuel Ferre; Violeta Redondo; Nancy Barbosa; Paul Espinosa; Miguel Á. Sánchez-Urán,10.1007/978-3-031-76424-0_2,,https://doi.org/10.1007/978-3-031-76424-0_2,crossref,EBM transformer robotics tool use robotics,concept,architecture_x_embodiment,,,EBM transformer robotics; tool use robotics,2026-06-12T15:07:36Z,15.400,15.400
doi:10.1115/detc2014-35513,Design of an Underactuated Robotic End-Effector With a Focus on Power Tool Manipulation,End-effectors require careful design considerations to be able to successfully hold and use power tools while maintaining the ability to also grasp a wide range of other objects. This paper describes the design of an end effector for a humanoid robot built for disaster response scenarios. The end effector is comprised of two independently actuated fingers with two opposing stationary rigid hollow pylons built to allow the pinching of objects and to provide protection for the opposing fingers when retracted and not in use. Each finger has two degrees of freedom (DOF) and is actuated with one servo motor through the use of an underactuated four bar linkage. Using only two fingers and two actuators the end-effector has the ability to hold a power tool while also being able to simultaneously actuate the trigger of the tool independently. The combination of compliant fingers and rigid pylons ,2014,Volume 5B: 38th Mechanisms and Robotics Conference,Michael Rouleau; Dennis Hong,10.1115/detc2014-35513,,https://doi.org/10.1115/detc2014-35513,crossref,physical reasoning robotics manipulation,concept,physical_reasoning,,8,humanoid robot,2026-06-12T15:07:36Z,15.399,15.399
doi:10.1007/978-3-319-31800-4_6,Manipulation of Insect Reproductive Systems as a Tool in Pest Control,,2016,Advances in Insect Control and Resistance Management,Ally R. Harari; Rakefet Sharon; Phyllis G. Weintraub,10.1007/978-3-319-31800-4_6,,https://doi.org/10.1007/978-3-319-31800-4_6,crossref,hybrid systems robot control manipulation,anti_myopia,control,,6,hybrid systems,2026-06-12T15:07:36Z,15.373,18.373
doi:10.1016/j.heliyon.2024.e40925,Artificial intelligence and machine learning techniques for suicide prediction: Integrating dietary patterns and environmental contaminants,"Background: Suicide remains a leading cause of death globally, with nearly 800,000 deaths annually, particularly among young adults in regions like Europe, Australia, and the Middle East, highlighting the urgent need for innovative intervention strategies beyond conventional methods. Objectives: This review aims to explore the transformative role of artificial intelligence (AI) and machine learning (ML) in enhancing suicide risk prediction and developing effective prevention strategies, examining how these technologies integrate complex risk factors, including psychiatric, socio-economic, dietary, and environmental influences. Methods: A comprehensive review of literature from databases such as PubMed and Web of Science was conducted, focusing on studies that utilize AI and ML technologies. The review assessed the efficacy of various models, including Random Forest, neural networks, and ",2024,Heliyon,Mayyas Al‐Remawi; Ahmed S.A. Ali Agha; Faisal Al‐Akayleh; Faisal Aburub; Rami A. Abdel‐Rahem,10.1016/j.heliyon.2024.e40925,,https://doi.org/10.1016/j.heliyon.2024.e40925,openalex,energy based model robot learning,concept,ebm,,22,deployment,2026-06-12T18:26:24Z,15.368,16.368
doi:10.1109/robio54168.2021.9739349,Maximizing the Use of Environmental Constraints: A Pushing-Based Hybrid Position/Force Assembly Skill for Contact-Rich Tasks,,2021,2021 IEEE International Conference on Robotics and Biomimetics (ROBIO),Yunlei Shi; Zhaopeng Chen; Lin Cong; Yansong Wu; Martin Craiu-Müller; Chengjie Yuan; Chunyang Chang; Lei Zhang; Jianwei Zhang,10.1109/robio54168.2021.9739349,,https://doi.org/10.1109/robio54168.2021.9739349,crossref,contact rich manipulation learning,concept,contact,,2,contact rich manipulation,2026-06-12T15:07:36Z,15.349,15.349
